[
  {
    "id": "111:1",
    "surah": "111",
    "number": 1,
    "globalNumber": 6217,
    "bismillah": true,
    "arabic": "تَبَّتۡ يَدَآ أَبِي لَهَبٖ وَتَبَّ",
    "urdu": "ٹوٹ گئے ابولہب کے ہاتھ اور نامراد ہو گیا وہ",
    "english": "May the hands of Abu Lahab be ruined, and ruined is he",
    "tafsir": {
      "source": "Bayan ul Quran",
      "paragraphs": [
        "’’ابولہب‘‘ ایک اعتبار سے ایک شخص کا نام ہے۔ اور دوسرے اعتبار سے وہ ایک کردار ہے۔ ابولہب دعوتِ حق کے اس مخالف کی تاریخی علامت ہے جو کمینہ پن کی حد تک اس کا دشمن بن جائے۔ اس کردار سے جس طرح رسول اللہ صلی اللہ علیہ وسلم کو سابقہ پیش آیا، اسی طرح آپ کی امت کے دوسرے داعیوں کو بھی اس سے سابقہ پیش آ سکتا ہے۔ تاہم اگر داعی حقیقی معنوں میں اللہ کے لیے اٹھا ہے تو اللہ کی مدد اس کا ساتھ دے گی۔ ابولہب جیسے لوگوں کی معاندانہ کوششیں اللہ کی مدد سے بے اثر ہوجائیں گی۔ اپنے تمام ذرائع اور وسائل کے باوجود وہ برباد ہو کر رہے گا۔ وہ اپنے عناد میں خود چلے گا، وہ خدا کے داعی کو جس برے انجام تک پہنچانا چاہتا تھا وہیں وہ خود ابدی طور پر پہنچا دیا جائے گا۔"
      ]
    },
    "themes": [
      "story-muhammad",
      "kufr",
      "family",
      "warnings"
    ],
    "related": []
  },
  {
    "id": "111:2",
    "surah": "111",
    "number": 2,
    "globalNumber": 6218,
    "bismillah": false,
    "arabic": "مَآ أَغۡنَىٰ عَنۡهُ مَالُهُۥ وَمَا كَسَبَ",
    "urdu": "اُس کا مال اور جو کچھ اس نے کمایا وہ اُس کے کسی کام نہ آیا",
    "english": "His wealth will not avail him or that which he gained",
    "tafsir": {
      "source": "Bayan ul Quran",
      "paragraphs": [
        "’’ابولہب‘‘ ایک اعتبار سے ایک شخص کا نام ہے۔ اور دوسرے اعتبار سے وہ ایک کردار ہے۔ ابولہب دعوتِ حق کے اس مخالف کی تاریخی علامت ہے جو کمینہ پن کی حد تک اس کا دشمن بن جائے۔ اس کردار سے جس طرح رسول اللہ صلی اللہ علیہ وسلم کو سابقہ پیش آیا، اسی طرح آپ کی امت کے دوسرے داعیوں کو بھی اس سے سابقہ پیش آ سکتا ہے۔ تاہم اگر داعی حقیقی معنوں میں اللہ کے لیے اٹھا ہے تو اللہ کی مدد اس کا ساتھ دے گی۔ ابولہب جیسے لوگوں کی معاندانہ کوششیں اللہ کی مدد سے بے اثر ہوجائیں گی۔ اپنے تمام ذرائع اور وسائل کے باوجود وہ برباد ہو کر رہے گا۔ وہ اپنے عناد میں خود چلے گا، وہ خدا کے داعی کو جس برے انجام تک پہنچانا چاہتا تھا وہیں وہ خود ابدی طور پر پہنچا دیا جائے گا۔"
      ]
    },
    "themes": [
      "wealth",
      "dunya",
      "kufr"
    ],
    "related": []
  },
  {
    "id": "111:3",
    "surah": "111",
    "number": 3,
    "globalNumber": 6219,
    "bismillah": false,
    "arabic": "سَيَصۡلَىٰ نَارٗا ذَاتَ لَهَبٖ",
    "urdu": "ضرور وہ شعلہ زن آگ میں ڈالا جائے گا",
    "english": "He will [enter to] burn in a Fire of [blazing] flame",
    "tafsir": {
      "source": "Bayan ul Quran",
      "paragraphs": [
        "’’ابولہب‘‘ ایک اعتبار سے ایک شخص کا نام ہے۔ اور دوسرے اعتبار سے وہ ایک کردار ہے۔ ابولہب دعوتِ حق کے اس مخالف کی تاریخی علامت ہے جو کمینہ پن کی حد تک اس کا دشمن بن جائے۔ اس کردار سے جس طرح رسول اللہ صلی اللہ علیہ وسلم کو سابقہ پیش آیا، اسی طرح آپ کی امت کے دوسرے داعیوں کو بھی اس سے سابقہ پیش آ سکتا ہے۔ تاہم اگر داعی حقیقی معنوں میں اللہ کے لیے اٹھا ہے تو اللہ کی مدد اس کا ساتھ دے گی۔ ابولہب جیسے لوگوں کی معاندانہ کوششیں اللہ کی مدد سے بے اثر ہوجائیں گی۔ اپنے تمام ذرائع اور وسائل کے باوجود وہ برباد ہو کر رہے گا۔ وہ اپنے عناد میں خود چلے گا، وہ خدا کے داعی کو جس برے انجام تک پہنچانا چاہتا تھا وہیں وہ خود ابدی طور پر پہنچا دیا جائے گا۔"
      ]
    },
    "themes": [
      "jahannam",
      "kufr"
    ],
    "related": []
  },
  {
    "id": "111:4",
    "surah": "111",
    "number": 4,
    "globalNumber": 6220,
    "bismillah": false,
    "arabic": "وَٱمۡرَأَتُهُۥ حَمَّالَةَ ٱلۡحَطَبِ",
    "urdu": "اور (اُس کے ساتھ) اُس کی جورو بھی، لگائی بجھائی کرنے والی",
    "english": "And his wife [as well] - the carrier of firewood",
    "tafsir": {
      "source": "Bayan ul Quran",
      "paragraphs": [
        "’’ابولہب‘‘ ایک اعتبار سے ایک شخص کا نام ہے۔ اور دوسرے اعتبار سے وہ ایک کردار ہے۔ ابولہب دعوتِ حق کے اس مخالف کی تاریخی علامت ہے جو کمینہ پن کی حد تک اس کا دشمن بن جائے۔ اس کردار سے جس طرح رسول اللہ صلی اللہ علیہ وسلم کو سابقہ پیش آیا، اسی طرح آپ کی امت کے دوسرے داعیوں کو بھی اس سے سابقہ پیش آ سکتا ہے۔ تاہم اگر داعی حقیقی معنوں میں اللہ کے لیے اٹھا ہے تو اللہ کی مدد اس کا ساتھ دے گی۔ ابولہب جیسے لوگوں کی معاندانہ کوششیں اللہ کی مدد سے بے اثر ہوجائیں گی۔ اپنے تمام ذرائع اور وسائل کے باوجود وہ برباد ہو کر رہے گا۔ وہ اپنے عناد میں خود چلے گا، وہ خدا کے داعی کو جس برے انجام تک پہنچانا چاہتا تھا وہیں وہ خود ابدی طور پر پہنچا دیا جائے گا۔"
      ]
    },
    "themes": [
      "women",
      "kufr",
      "oppression",
      "jahannam"
    ],
    "related": []
  },
  {
    "id": "111:5",
    "surah": "111",
    "number": 5,
    "globalNumber": 6221,
    "bismillah": false,
    "arabic": "فِي جِيدِهَا حَبۡلٞ مِّن مَّسَدِۭ",
    "urdu": "اُس کی گردن میں مونجھ کی رسی ہوگی",
    "english": "Around her neck is a rope of [twisted] fiber",
    "tafsir": {
      "source": "Bayan ul Quran",
      "paragraphs": [
        "’’ابولہب‘‘ ایک اعتبار سے ایک شخص کا نام ہے۔ اور دوسرے اعتبار سے وہ ایک کردار ہے۔ ابولہب دعوتِ حق کے اس مخالف کی تاریخی علامت ہے جو کمینہ پن کی حد تک اس کا دشمن بن جائے۔ اس کردار سے جس طرح رسول اللہ صلی اللہ علیہ وسلم کو سابقہ پیش آیا، اسی طرح آپ کی امت کے دوسرے داعیوں کو بھی اس سے سابقہ پیش آ سکتا ہے۔ تاہم اگر داعی حقیقی معنوں میں اللہ کے لیے اٹھا ہے تو اللہ کی مدد اس کا ساتھ دے گی۔ ابولہب جیسے لوگوں کی معاندانہ کوششیں اللہ کی مدد سے بے اثر ہوجائیں گی۔ اپنے تمام ذرائع اور وسائل کے باوجود وہ برباد ہو کر رہے گا۔ وہ اپنے عناد میں خود چلے گا، وہ خدا کے داعی کو جس برے انجام تک پہنچانا چاہتا تھا وہیں وہ خود ابدی طور پر پہنچا دیا جائے گا۔"
      ]
    },
    "themes": [
      "jahannam",
      "women"
    ],
    "related": []
  }
]
