[
  {
    "id": "110:1",
    "surah": "110",
    "number": 1,
    "globalNumber": 6214,
    "bismillah": true,
    "arabic": "إِذَا جَآءَ نَصۡرُ ٱللَّهِ وَٱلۡفَتۡحُ",
    "urdu": "جب اللہ کی مدد آ جائے اور فتح نصیب ہو جائے",
    "english": "When the victory of Allah has come and the conquest",
    "tafsir": {
      "source": "Bayan ul Quran",
      "paragraphs": [
        "اللہ کی وہ مدد جس کا نام فتح ہے، وہ ہمیشہ دعوت کی راہ سے آتی ہے۔ لوگوں کو جوق در جوق دین خدا کے دائرے میں داخل کیا جانا، یہی اللہ کی سب سے بڑی مددہے۔ اور اسی راہ سے اہل دین فتح و غلبہ کی منزل تک پہنچتے ہیں۔ چنانچہ رسول اللہ صلی اللہ علیہ وسلم کے آخری زمانہ (",
        "9-10",
        "ھ) میں وہ حالات پیدا ہوئے جب كہ لوگ بہت بڑی تعداد میں خدا کے دین میں داخل ہوگئے۔ اور اس کے ذریعہ فتوحات کا دروازہ کھل گیا۔",
        "مومن کی فتح اس کے احساس عجز میں اضافہ کرتی ہے۔ وہ اپنے بظاہر صحیح کام پر بھی خدا سے معافی مانگتا ہے۔ وہ بظاہر اپنی کوششوں سے ملنے والی کامیابی کو بھی خدا کے خانہ میں ڈال دیتا ہے۔"
      ]
    },
    "themes": [
      "story-muhammad",
      "conflict",
      "glad-tidings"
    ],
    "related": []
  },
  {
    "id": "110:2",
    "surah": "110",
    "number": 2,
    "globalNumber": 6215,
    "bismillah": false,
    "arabic": "وَرَأَيۡتَ ٱلنَّاسَ يَدۡخُلُونَ فِي دِينِ ٱللَّهِ أَفۡوَاجٗا",
    "urdu": "اور (اے نبیؐ) تم دیکھ لو کہ لوگ فوج در فوج اللہ کے دین میں داخل ہو رہے ہیں",
    "english": "And you see the people entering into the religion of Allah in multitudes",
    "tafsir": {
      "source": "Bayan ul Quran",
      "paragraphs": [
        "اللہ کی وہ مدد جس کا نام فتح ہے، وہ ہمیشہ دعوت کی راہ سے آتی ہے۔ لوگوں کو جوق در جوق دین خدا کے دائرے میں داخل کیا جانا، یہی اللہ کی سب سے بڑی مددہے۔ اور اسی راہ سے اہل دین فتح و غلبہ کی منزل تک پہنچتے ہیں۔ چنانچہ رسول اللہ صلی اللہ علیہ وسلم کے آخری زمانہ (",
        "9-10",
        "ھ) میں وہ حالات پیدا ہوئے جب كہ لوگ بہت بڑی تعداد میں خدا کے دین میں داخل ہوگئے۔ اور اس کے ذریعہ فتوحات کا دروازہ کھل گیا۔",
        "مومن کی فتح اس کے احساس عجز میں اضافہ کرتی ہے۔ وہ اپنے بظاہر صحیح کام پر بھی خدا سے معافی مانگتا ہے۔ وہ بظاہر اپنی کوششوں سے ملنے والی کامیابی کو بھی خدا کے خانہ میں ڈال دیتا ہے۔"
      ]
    },
    "themes": [
      "story-muhammad",
      "dawah",
      "community",
      "hidayah"
    ],
    "related": []
  },
  {
    "id": "110:3",
    "surah": "110",
    "number": 3,
    "globalNumber": 6216,
    "bismillah": false,
    "arabic": "فَسَبِّحۡ بِحَمۡدِ رَبِّكَ وَٱسۡتَغۡفِرۡهُۚ إِنَّهُۥ كَانَ تَوَّابَۢا",
    "urdu": "تو اپنے رب کی حمد کے ساتھ اُس کی تسبیح کرو، اور اُس سے مغفرت کی دعا مانگو، بے شک وہ بڑا توبہ قبول کرنے والا ہے",
    "english": "Then exalt [Him] with praise of your Lord and ask forgiveness of Him. Indeed, He is ever Accepting of repentance",
    "tafsir": {
      "source": "Bayan ul Quran",
      "paragraphs": [
        "اللہ کی وہ مدد جس کا نام فتح ہے، وہ ہمیشہ دعوت کی راہ سے آتی ہے۔ لوگوں کو جوق در جوق دین خدا کے دائرے میں داخل کیا جانا، یہی اللہ کی سب سے بڑی مددہے۔ اور اسی راہ سے اہل دین فتح و غلبہ کی منزل تک پہنچتے ہیں۔ چنانچہ رسول اللہ صلی اللہ علیہ وسلم کے آخری زمانہ (",
        "9-10",
        "ھ) میں وہ حالات پیدا ہوئے جب كہ لوگ بہت بڑی تعداد میں خدا کے دین میں داخل ہوگئے۔ اور اس کے ذریعہ فتوحات کا دروازہ کھل گیا۔",
        "مومن کی فتح اس کے احساس عجز میں اضافہ کرتی ہے۔ وہ اپنے بظاہر صحیح کام پر بھی خدا سے معافی مانگتا ہے۔ وہ بظاہر اپنی کوششوں سے ملنے والی کامیابی کو بھی خدا کے خانہ میں ڈال دیتا ہے۔"
      ]
    },
    "themes": [
      "dhikr",
      "tawbah",
      "shukr",
      "commands"
    ],
    "related": []
  }
]
