[
  {
    "id": "103:1",
    "surah": "103",
    "number": 1,
    "globalNumber": 6177,
    "bismillah": true,
    "arabic": "وَٱلۡعَصۡرِ",
    "urdu": "زمانے کی قسم",
    "english": "By time",
    "tafsir": {
      "source": "Bayan ul Quran",
      "paragraphs": [
        "زمانه كيا هے۔ گزرتا هوا وقت۔ زمانے كے گزرتے هوئے دھارے ميں انسان بھي بهه رها هے۔ همارا حال هر آن ماضي ميں تبديل هورهاهے۔انسان ہر لمحہ اپنی موت کی طرف جا رہا ہے۔انسان كي كاميابي يه هے كه وه زندگي ختم هونے سے پهلے اپنا كام پورا كرلے۔ اس کا مطلب یہ ہے کہ آدمی اگر اپنی مہلتِ عمر کو استعمال نہ کرے تو آخر کار اس کے حصہ میں جو چیز آئے گی وہ صرف ہلاکت ہے۔ کامیاب ہونے کے لیے آدمی کو خود عمل کرنا ہے۔ جب کہ ناکامی کے لیے کسی عمل کی ضرورت نہیں۔ وہ اپنے آپ اس کی طرف بھاگی چلی آ رہی ہے۔",
        "ایک بزرگ نے کہا کہ سورۃ عصر کا مطلب میں نے ایک برف بیچنے والے سے سمجھا جو بازار میں آواز لگا رہا تھا کہ لوگو، اس شخص پر رحم کرو جس کا اثاثہ گھل رہا ہے، لوگو، اس شخص پر رحم کرو، جس کا اثاثہ گھل رہا ہے۔ اس پکار کو سن کر میں نے اپنے دل میں کہا کہ جس طرح برف پگھل کر کم ہوتی رہتی ہے اسی طرح انسان کو ملی ہوئی عمر بھی تیزی سے گزر رہی ہے۔ عمر کا موقع اگر بے عملی میں یا برے کاموں میں کھو دیا جائے تو یہی انسان کا گھاٹا ہے۔ (تفسیر کبیر امام رازی، جلد",
        "32",
        "، ص",
        "278",
        ")",
        "اپنے وقت کو صحیح استعمال کرنے والا وہ ہے جو موجودہ دنیامیں تین باتوں کا ثبوت دے۔ ایک ایمان، یعنی حقیقت کا شعور اور اس کا اعتراف۔ دوسرے عمل صالح، یعنی وہی کرنا جو کر نا چاہيے اور وہ نہ کرنا جو نہیں کرنا چاہيے۔ تیسرے حق و صبر کی تلقین ، یعنی حقیقت کا اتنا گہرا ادر اک کہ آدمی اس کاداعی اور مبلغ بن جائے۔"
      ]
    },
    "themes": [
      "oaths",
      "time"
    ],
    "related": []
  },
  {
    "id": "103:2",
    "surah": "103",
    "number": 2,
    "globalNumber": 6178,
    "bismillah": false,
    "arabic": "إِنَّ ٱلۡإِنسَٰنَ لَفِي خُسۡرٍ",
    "urdu": "انسان درحقیقت بڑے خسارے میں ہے",
    "english": "Indeed, mankind is in loss",
    "tafsir": {
      "source": "Bayan ul Quran",
      "paragraphs": [
        "زمانه كيا هے۔ گزرتا هوا وقت۔ زمانے كے گزرتے هوئے دھارے ميں انسان بھي بهه رها هے۔ همارا حال هر آن ماضي ميں تبديل هورهاهے۔انسان ہر لمحہ اپنی موت کی طرف جا رہا ہے۔انسان كي كاميابي يه هے كه وه زندگي ختم هونے سے پهلے اپنا كام پورا كرلے۔ اس کا مطلب یہ ہے کہ آدمی اگر اپنی مہلتِ عمر کو استعمال نہ کرے تو آخر کار اس کے حصہ میں جو چیز آئے گی وہ صرف ہلاکت ہے۔ کامیاب ہونے کے لیے آدمی کو خود عمل کرنا ہے۔ جب کہ ناکامی کے لیے کسی عمل کی ضرورت نہیں۔ وہ اپنے آپ اس کی طرف بھاگی چلی آ رہی ہے۔",
        "ایک بزرگ نے کہا کہ سورۃ عصر کا مطلب میں نے ایک برف بیچنے والے سے سمجھا جو بازار میں آواز لگا رہا تھا کہ لوگو، اس شخص پر رحم کرو جس کا اثاثہ گھل رہا ہے، لوگو، اس شخص پر رحم کرو، جس کا اثاثہ گھل رہا ہے۔ اس پکار کو سن کر میں نے اپنے دل میں کہا کہ جس طرح برف پگھل کر کم ہوتی رہتی ہے اسی طرح انسان کو ملی ہوئی عمر بھی تیزی سے گزر رہی ہے۔ عمر کا موقع اگر بے عملی میں یا برے کاموں میں کھو دیا جائے تو یہی انسان کا گھاٹا ہے۔ (تفسیر کبیر امام رازی، جلد",
        "32",
        "، ص",
        "278",
        ")",
        "اپنے وقت کو صحیح استعمال کرنے والا وہ ہے جو موجودہ دنیامیں تین باتوں کا ثبوت دے۔ ایک ایمان، یعنی حقیقت کا شعور اور اس کا اعتراف۔ دوسرے عمل صالح، یعنی وہی کرنا جو کر نا چاہيے اور وہ نہ کرنا جو نہیں کرنا چاہيے۔ تیسرے حق و صبر کی تلقین ، یعنی حقیقت کا اتنا گہرا ادر اک کہ آدمی اس کاداعی اور مبلغ بن جائے۔"
      ]
    },
    "themes": [
      "dunya",
      "akhirah",
      "warnings"
    ],
    "related": []
  },
  {
    "id": "103:3",
    "surah": "103",
    "number": 3,
    "globalNumber": 6179,
    "bismillah": false,
    "arabic": "إِلَّا ٱلَّذِينَ ءَامَنُواْ وَعَمِلُواْ ٱلصَّـٰلِحَٰتِ وَتَوَاصَوۡاْ بِٱلۡحَقِّ وَتَوَاصَوۡاْ بِٱلصَّبۡرِ",
    "urdu": "سوائے اُن لوگوں کے جو ایمان لائے، اور نیک اعمال کرتے رہے، اور ایک دوسرے کو حق کی نصیحت اور صبر کی تلقین کرتے رہے",
    "english": "Except for those who have believed and done righteous deeds and advised each other to truth and advised each other to patience",
    "tafsir": {
      "source": "Bayan ul Quran",
      "paragraphs": [
        "زمانه كيا هے۔ گزرتا هوا وقت۔ زمانے كے گزرتے هوئے دھارے ميں انسان بھي بهه رها هے۔ همارا حال هر آن ماضي ميں تبديل هورهاهے۔انسان ہر لمحہ اپنی موت کی طرف جا رہا ہے۔انسان كي كاميابي يه هے كه وه زندگي ختم هونے سے پهلے اپنا كام پورا كرلے۔ اس کا مطلب یہ ہے کہ آدمی اگر اپنی مہلتِ عمر کو استعمال نہ کرے تو آخر کار اس کے حصہ میں جو چیز آئے گی وہ صرف ہلاکت ہے۔ کامیاب ہونے کے لیے آدمی کو خود عمل کرنا ہے۔ جب کہ ناکامی کے لیے کسی عمل کی ضرورت نہیں۔ وہ اپنے آپ اس کی طرف بھاگی چلی آ رہی ہے۔",
        "ایک بزرگ نے کہا کہ سورۃ عصر کا مطلب میں نے ایک برف بیچنے والے سے سمجھا جو بازار میں آواز لگا رہا تھا کہ لوگو، اس شخص پر رحم کرو جس کا اثاثہ گھل رہا ہے، لوگو، اس شخص پر رحم کرو، جس کا اثاثہ گھل رہا ہے۔ اس پکار کو سن کر میں نے اپنے دل میں کہا کہ جس طرح برف پگھل کر کم ہوتی رہتی ہے اسی طرح انسان کو ملی ہوئی عمر بھی تیزی سے گزر رہی ہے۔ عمر کا موقع اگر بے عملی میں یا برے کاموں میں کھو دیا جائے تو یہی انسان کا گھاٹا ہے۔ (تفسیر کبیر امام رازی، جلد",
        "32",
        "، ص",
        "278",
        ")",
        "اپنے وقت کو صحیح استعمال کرنے والا وہ ہے جو موجودہ دنیامیں تین باتوں کا ثبوت دے۔ ایک ایمان، یعنی حقیقت کا شعور اور اس کا اعتراف۔ دوسرے عمل صالح، یعنی وہی کرنا جو کر نا چاہيے اور وہ نہ کرنا جو نہیں کرنا چاہيے۔ تیسرے حق و صبر کی تلقین ، یعنی حقیقت کا اتنا گہرا ادر اک کہ آدمی اس کاداعی اور مبلغ بن جائے۔"
      ]
    },
    "themes": [
      "iman",
      "sabr",
      "sidq",
      "dawah",
      "community"
    ],
    "related": []
  }
]
