[
  {
    "id": "106:1",
    "surah": "106",
    "number": 1,
    "globalNumber": 6194,
    "bismillah": true,
    "arabic": "لِإِيلَٰفِ قُرَيۡشٍ",
    "urdu": "چونکہ قریش مانوس ہوئے",
    "english": "For the accustomed security of the Quraysh",
    "tafsir": {
      "source": "Bayan ul Quran",
      "paragraphs": [
        "قریش ایک تجارتی قوم تھے۔ گرمی کے زمانہ میں ان کے تجارتی قافلے شام اور فلسطین کی طرف جاتے تھے، اور سردیوں کے زمانہ میں وہ یمن کی طرف تجارتی سفر کرتے تھے۔ انہیں تجارتوں پر ان کی معاشیات کا انحصار تھا۔ قدیم زمانہ میں جب کہ تاجروں کو لوٹنا عام تھا، قریش کے قافلے راستے میں لوٹے نہیں جاتے تھے۔ اس کی وجہ کعبہ سے ان کا تعلق تھا۔ قریش کعبہ کے خادم اور متولی تھے اور لوگوں کے ذہنوں پر چوں کہ کعبہ کا بہت زیادہ احترام تھا۔ وہ کعبہ کے خادموں اور متولیوں کا بھی احترام کرتے تھے اور اس بنا پر وہ ان کو نہیں لوٹتے تھے۔",
        "یہاں حکمتِ دعوت کے تحت قریش کو یہ واقعہ یاد دلاتے ہوئے انہیں اسلام کی طرف بلایا گیا ہے۔ اور کہا گیا ہے کہ یہ بڑی ناشکری کی بات ہوگی کہ تم بیت اللہ کے دنیوی فائدے تو حاصل کرو، اور اس سے وابستہ ہونے کی جو ذمہ داریاں ہیں ان کو پورا نہ کرو۔ جو خدا انسان کو مادی فائدے پہنچاتا ہے اسی خدا کی اس کو عبادت بھی کرني چاہيے۔"
      ]
    },
    "themes": [
      "kaaba",
      "rizq",
      "shukr"
    ],
    "related": []
  },
  {
    "id": "106:2",
    "surah": "106",
    "number": 2,
    "globalNumber": 6195,
    "bismillah": false,
    "arabic": "إِۦلَٰفِهِمۡ رِحۡلَةَ ٱلشِّتَآءِ وَٱلصَّيۡفِ",
    "urdu": "(یعنی) جاڑے اور گرمی کے سفروں سے مانوس",
    "english": "Their accustomed security [in] the caravan of winter and summer",
    "tafsir": {
      "source": "Bayan ul Quran",
      "paragraphs": [
        "قریش ایک تجارتی قوم تھے۔ گرمی کے زمانہ میں ان کے تجارتی قافلے شام اور فلسطین کی طرف جاتے تھے، اور سردیوں کے زمانہ میں وہ یمن کی طرف تجارتی سفر کرتے تھے۔ انہیں تجارتوں پر ان کی معاشیات کا انحصار تھا۔ قدیم زمانہ میں جب کہ تاجروں کو لوٹنا عام تھا، قریش کے قافلے راستے میں لوٹے نہیں جاتے تھے۔ اس کی وجہ کعبہ سے ان کا تعلق تھا۔ قریش کعبہ کے خادم اور متولی تھے اور لوگوں کے ذہنوں پر چوں کہ کعبہ کا بہت زیادہ احترام تھا۔ وہ کعبہ کے خادموں اور متولیوں کا بھی احترام کرتے تھے اور اس بنا پر وہ ان کو نہیں لوٹتے تھے۔",
        "یہاں حکمتِ دعوت کے تحت قریش کو یہ واقعہ یاد دلاتے ہوئے انہیں اسلام کی طرف بلایا گیا ہے۔ اور کہا گیا ہے کہ یہ بڑی ناشکری کی بات ہوگی کہ تم بیت اللہ کے دنیوی فائدے تو حاصل کرو، اور اس سے وابستہ ہونے کی جو ذمہ داریاں ہیں ان کو پورا نہ کرو۔ جو خدا انسان کو مادی فائدے پہنچاتا ہے اسی خدا کی اس کو عبادت بھی کرني چاہيے۔"
      ]
    },
    "themes": [
      "kaaba",
      "trade",
      "rizq"
    ],
    "related": []
  },
  {
    "id": "106:3",
    "surah": "106",
    "number": 3,
    "globalNumber": 6196,
    "bismillah": false,
    "arabic": "فَلۡيَعۡبُدُواْ رَبَّ هَٰذَا ٱلۡبَيۡتِ",
    "urdu": "لہٰذا اُن کو چاہیے کہ اِس گھر کے رب کی عبادت کریں",
    "english": "Let them worship the Lord of this House",
    "tafsir": {
      "source": "Bayan ul Quran",
      "paragraphs": [
        "قریش ایک تجارتی قوم تھے۔ گرمی کے زمانہ میں ان کے تجارتی قافلے شام اور فلسطین کی طرف جاتے تھے، اور سردیوں کے زمانہ میں وہ یمن کی طرف تجارتی سفر کرتے تھے۔ انہیں تجارتوں پر ان کی معاشیات کا انحصار تھا۔ قدیم زمانہ میں جب کہ تاجروں کو لوٹنا عام تھا، قریش کے قافلے راستے میں لوٹے نہیں جاتے تھے۔ اس کی وجہ کعبہ سے ان کا تعلق تھا۔ قریش کعبہ کے خادم اور متولی تھے اور لوگوں کے ذہنوں پر چوں کہ کعبہ کا بہت زیادہ احترام تھا۔ وہ کعبہ کے خادموں اور متولیوں کا بھی احترام کرتے تھے اور اس بنا پر وہ ان کو نہیں لوٹتے تھے۔",
        "یہاں حکمتِ دعوت کے تحت قریش کو یہ واقعہ یاد دلاتے ہوئے انہیں اسلام کی طرف بلایا گیا ہے۔ اور کہا گیا ہے کہ یہ بڑی ناشکری کی بات ہوگی کہ تم بیت اللہ کے دنیوی فائدے تو حاصل کرو، اور اس سے وابستہ ہونے کی جو ذمہ داریاں ہیں ان کو پورا نہ کرو۔ جو خدا انسان کو مادی فائدے پہنچاتا ہے اسی خدا کی اس کو عبادت بھی کرني چاہيے۔"
      ]
    },
    "themes": [
      "kaaba",
      "tawheed",
      "commands"
    ],
    "related": []
  },
  {
    "id": "106:4",
    "surah": "106",
    "number": 4,
    "globalNumber": 6197,
    "bismillah": false,
    "arabic": "ٱلَّذِيٓ أَطۡعَمَهُم مِّن جُوعٖ وَءَامَنَهُم مِّنۡ خَوۡفِۭ",
    "urdu": "جس نے اُنہیں بھوک سے بچا کر کھانے کو دیا اور خوف سے بچا کر امن عطا کیا",
    "english": "Who has fed them, [saving them] from hunger and made them safe, [saving them] from fear",
    "tafsir": {
      "source": "Bayan ul Quran",
      "paragraphs": [
        "قریش ایک تجارتی قوم تھے۔ گرمی کے زمانہ میں ان کے تجارتی قافلے شام اور فلسطین کی طرف جاتے تھے، اور سردیوں کے زمانہ میں وہ یمن کی طرف تجارتی سفر کرتے تھے۔ انہیں تجارتوں پر ان کی معاشیات کا انحصار تھا۔ قدیم زمانہ میں جب کہ تاجروں کو لوٹنا عام تھا، قریش کے قافلے راستے میں لوٹے نہیں جاتے تھے۔ اس کی وجہ کعبہ سے ان کا تعلق تھا۔ قریش کعبہ کے خادم اور متولی تھے اور لوگوں کے ذہنوں پر چوں کہ کعبہ کا بہت زیادہ احترام تھا۔ وہ کعبہ کے خادموں اور متولیوں کا بھی احترام کرتے تھے اور اس بنا پر وہ ان کو نہیں لوٹتے تھے۔",
        "یہاں حکمتِ دعوت کے تحت قریش کو یہ واقعہ یاد دلاتے ہوئے انہیں اسلام کی طرف بلایا گیا ہے۔ اور کہا گیا ہے کہ یہ بڑی ناشکری کی بات ہوگی کہ تم بیت اللہ کے دنیوی فائدے تو حاصل کرو، اور اس سے وابستہ ہونے کی جو ذمہ داریاں ہیں ان کو پورا نہ کرو۔ جو خدا انسان کو مادی فائدے پہنچاتا ہے اسی خدا کی اس کو عبادت بھی کرني چاہيے۔"
      ]
    },
    "themes": [
      "rizq",
      "shukr",
      "anxiety-fear",
      "kaaba"
    ],
    "related": []
  }
]
