[
  {
    "id": "100:1",
    "surah": "100",
    "number": 1,
    "globalNumber": 6147,
    "bismillah": true,
    "arabic": "وَٱلۡعَٰدِيَٰتِ ضَبۡحٗا",
    "urdu": "قسم ہے اُن (گھوڑوں) کی جو پھنکارے مارتے ہوئے دوڑتے ہیں",
    "english": "By the racers, panting",
    "tafsir": {
      "source": "Bayan ul Quran",
      "paragraphs": [
        "آدمی چاہتا ہے کہ وہ زیادہ سے زیادہ کمائے، وہ زیادہ سے زیادہ سازوسامان اپنے پاس جمع کرے۔ وہ اسی دھن میں لگا رہتا ہے۔ یہاں تک کہ اس کی موت آجاتی ہے۔ اس وقت اس کو معلوم ہوتا ہے کہ جمع کرنے کی چیز تو دوسری تھی اور میں کسی اور چیز کو جمع کرنے میں مصروف رہا۔",
        "دنیا کی چیزوں کا اضافہ صرف آدمی کی مسئولیت کو بڑھاتا ہے۔ اور آدمی اپنی نادانی سے یہ سمجھتا ہے کہ وہ اپنی کامیابی میں اضافہ کر رہا ہے۔"
      ]
    },
    "themes": [
      "oaths",
      "animals",
      "conflict"
    ],
    "related": []
  },
  {
    "id": "100:2",
    "surah": "100",
    "number": 2,
    "globalNumber": 6148,
    "bismillah": false,
    "arabic": "فَٱلۡمُورِيَٰتِ قَدۡحٗا",
    "urdu": "پھر (اپنی ٹاپوں سے) چنگاریاں جھاڑتے ہیں",
    "english": "And the producers of sparks [when] striking",
    "tafsir": {
      "source": "Bayan ul Quran",
      "paragraphs": [
        "آدمی چاہتا ہے کہ وہ زیادہ سے زیادہ کمائے، وہ زیادہ سے زیادہ سازوسامان اپنے پاس جمع کرے۔ وہ اسی دھن میں لگا رہتا ہے۔ یہاں تک کہ اس کی موت آجاتی ہے۔ اس وقت اس کو معلوم ہوتا ہے کہ جمع کرنے کی چیز تو دوسری تھی اور میں کسی اور چیز کو جمع کرنے میں مصروف رہا۔",
        "دنیا کی چیزوں کا اضافہ صرف آدمی کی مسئولیت کو بڑھاتا ہے۔ اور آدمی اپنی نادانی سے یہ سمجھتا ہے کہ وہ اپنی کامیابی میں اضافہ کر رہا ہے۔"
      ]
    },
    "themes": [
      "oaths",
      "animals",
      "conflict"
    ],
    "related": []
  },
  {
    "id": "100:3",
    "surah": "100",
    "number": 3,
    "globalNumber": 6149,
    "bismillah": false,
    "arabic": "فَٱلۡمُغِيرَٰتِ صُبۡحٗا",
    "urdu": "پھر صبح سویرے چھاپہ مارتے ہیں",
    "english": "And the chargers at dawn",
    "tafsir": {
      "source": "Bayan ul Quran",
      "paragraphs": [
        "آدمی چاہتا ہے کہ وہ زیادہ سے زیادہ کمائے، وہ زیادہ سے زیادہ سازوسامان اپنے پاس جمع کرے۔ وہ اسی دھن میں لگا رہتا ہے۔ یہاں تک کہ اس کی موت آجاتی ہے۔ اس وقت اس کو معلوم ہوتا ہے کہ جمع کرنے کی چیز تو دوسری تھی اور میں کسی اور چیز کو جمع کرنے میں مصروف رہا۔",
        "دنیا کی چیزوں کا اضافہ صرف آدمی کی مسئولیت کو بڑھاتا ہے۔ اور آدمی اپنی نادانی سے یہ سمجھتا ہے کہ وہ اپنی کامیابی میں اضافہ کر رہا ہے۔"
      ]
    },
    "themes": [
      "oaths",
      "animals",
      "conflict"
    ],
    "related": []
  },
  {
    "id": "100:4",
    "surah": "100",
    "number": 4,
    "globalNumber": 6150,
    "bismillah": false,
    "arabic": "فَأَثَرۡنَ بِهِۦ نَقۡعٗا",
    "urdu": "پھر اس موقع پر گرد و غبار اڑاتے ہیں",
    "english": "Stirring up thereby [clouds of] dust",
    "tafsir": {
      "source": "Bayan ul Quran",
      "paragraphs": [
        "آدمی چاہتا ہے کہ وہ زیادہ سے زیادہ کمائے، وہ زیادہ سے زیادہ سازوسامان اپنے پاس جمع کرے۔ وہ اسی دھن میں لگا رہتا ہے۔ یہاں تک کہ اس کی موت آجاتی ہے۔ اس وقت اس کو معلوم ہوتا ہے کہ جمع کرنے کی چیز تو دوسری تھی اور میں کسی اور چیز کو جمع کرنے میں مصروف رہا۔",
        "دنیا کی چیزوں کا اضافہ صرف آدمی کی مسئولیت کو بڑھاتا ہے۔ اور آدمی اپنی نادانی سے یہ سمجھتا ہے کہ وہ اپنی کامیابی میں اضافہ کر رہا ہے۔"
      ]
    },
    "themes": [
      "oaths",
      "conflict"
    ],
    "related": []
  },
  {
    "id": "100:5",
    "surah": "100",
    "number": 5,
    "globalNumber": 6151,
    "bismillah": false,
    "arabic": "فَوَسَطۡنَ بِهِۦ جَمۡعًا",
    "urdu": "پھر اِسی حالت میں کسی مجمع کے اندر جا گھستے ہیں",
    "english": "Arriving thereby in the center collectively",
    "tafsir": {
      "source": "Bayan ul Quran",
      "paragraphs": [
        "آدمی چاہتا ہے کہ وہ زیادہ سے زیادہ کمائے، وہ زیادہ سے زیادہ سازوسامان اپنے پاس جمع کرے۔ وہ اسی دھن میں لگا رہتا ہے۔ یہاں تک کہ اس کی موت آجاتی ہے۔ اس وقت اس کو معلوم ہوتا ہے کہ جمع کرنے کی چیز تو دوسری تھی اور میں کسی اور چیز کو جمع کرنے میں مصروف رہا۔",
        "دنیا کی چیزوں کا اضافہ صرف آدمی کی مسئولیت کو بڑھاتا ہے۔ اور آدمی اپنی نادانی سے یہ سمجھتا ہے کہ وہ اپنی کامیابی میں اضافہ کر رہا ہے۔"
      ]
    },
    "themes": [
      "oaths",
      "conflict"
    ],
    "related": []
  },
  {
    "id": "100:6",
    "surah": "100",
    "number": 6,
    "globalNumber": 6152,
    "bismillah": false,
    "arabic": "إِنَّ ٱلۡإِنسَٰنَ لِرَبِّهِۦ لَكَنُودٞ",
    "urdu": "حقیقت یہ ہے کہ انسان اپنے رب کا بڑا ناشکرا ہے",
    "english": "Indeed mankind, to his Lord, is ungrateful",
    "tafsir": {
      "source": "Bayan ul Quran",
      "paragraphs": [
        "آدمی چاہتا ہے کہ وہ زیادہ سے زیادہ کمائے، وہ زیادہ سے زیادہ سازوسامان اپنے پاس جمع کرے۔ وہ اسی دھن میں لگا رہتا ہے۔ یہاں تک کہ اس کی موت آجاتی ہے۔ اس وقت اس کو معلوم ہوتا ہے کہ جمع کرنے کی چیز تو دوسری تھی اور میں کسی اور چیز کو جمع کرنے میں مصروف رہا۔",
        "دنیا کی چیزوں کا اضافہ صرف آدمی کی مسئولیت کو بڑھاتا ہے۔ اور آدمی اپنی نادانی سے یہ سمجھتا ہے کہ وہ اپنی کامیابی میں اضافہ کر رہا ہے۔"
      ]
    },
    "themes": [
      "shukr",
      "kufr",
      "human-creation"
    ],
    "related": []
  },
  {
    "id": "100:7",
    "surah": "100",
    "number": 7,
    "globalNumber": 6153,
    "bismillah": false,
    "arabic": "وَإِنَّهُۥ عَلَىٰ ذَٰلِكَ لَشَهِيدٞ",
    "urdu": "اور وہ خود اِس پر گواہ ہے",
    "english": "And indeed, he is to that a witness",
    "tafsir": {
      "source": "Bayan ul Quran",
      "paragraphs": [
        "آدمی چاہتا ہے کہ وہ زیادہ سے زیادہ کمائے، وہ زیادہ سے زیادہ سازوسامان اپنے پاس جمع کرے۔ وہ اسی دھن میں لگا رہتا ہے۔ یہاں تک کہ اس کی موت آجاتی ہے۔ اس وقت اس کو معلوم ہوتا ہے کہ جمع کرنے کی چیز تو دوسری تھی اور میں کسی اور چیز کو جمع کرنے میں مصروف رہا۔",
        "دنیا کی چیزوں کا اضافہ صرف آدمی کی مسئولیت کو بڑھاتا ہے۔ اور آدمی اپنی نادانی سے یہ سمجھتا ہے کہ وہ اپنی کامیابی میں اضافہ کر رہا ہے۔"
      ]
    },
    "themes": [
      "tazkiyah",
      "knowledge"
    ],
    "related": []
  },
  {
    "id": "100:8",
    "surah": "100",
    "number": 8,
    "globalNumber": 6154,
    "bismillah": false,
    "arabic": "وَإِنَّهُۥ لِحُبِّ ٱلۡخَيۡرِ لَشَدِيدٌ",
    "urdu": "اور وہ مال و دولت کی محبت میں بری طرح مبتلا ہے",
    "english": "And indeed he is, in love of wealth, intense",
    "tafsir": {
      "source": "Bayan ul Quran",
      "paragraphs": [
        "آدمی چاہتا ہے کہ وہ زیادہ سے زیادہ کمائے، وہ زیادہ سے زیادہ سازوسامان اپنے پاس جمع کرے۔ وہ اسی دھن میں لگا رہتا ہے۔ یہاں تک کہ اس کی موت آجاتی ہے۔ اس وقت اس کو معلوم ہوتا ہے کہ جمع کرنے کی چیز تو دوسری تھی اور میں کسی اور چیز کو جمع کرنے میں مصروف رہا۔",
        "دنیا کی چیزوں کا اضافہ صرف آدمی کی مسئولیت کو بڑھاتا ہے۔ اور آدمی اپنی نادانی سے یہ سمجھتا ہے کہ وہ اپنی کامیابی میں اضافہ کر رہا ہے۔"
      ]
    },
    "themes": [
      "wealth",
      "dunya",
      "human-creation"
    ],
    "related": []
  },
  {
    "id": "100:9",
    "surah": "100",
    "number": 9,
    "globalNumber": 6155,
    "bismillah": false,
    "arabic": "۞أَفَلَا يَعۡلَمُ إِذَا بُعۡثِرَ مَا فِي ٱلۡقُبُورِ",
    "urdu": "تو کیا وہ اُس حقیقت کو نہیں جانتا جب قبروں میں جو کچھ (مدفون) ہے اُسے نکال لیا جائے گا",
    "english": "But does he not know that when the contents of the graves are scattered",
    "tafsir": {
      "source": "Bayan ul Quran",
      "paragraphs": [
        "آدمی چاہتا ہے کہ وہ زیادہ سے زیادہ کمائے، وہ زیادہ سے زیادہ سازوسامان اپنے پاس جمع کرے۔ وہ اسی دھن میں لگا رہتا ہے۔ یہاں تک کہ اس کی موت آجاتی ہے۔ اس وقت اس کو معلوم ہوتا ہے کہ جمع کرنے کی چیز تو دوسری تھی اور میں کسی اور چیز کو جمع کرنے میں مصروف رہا۔",
        "دنیا کی چیزوں کا اضافہ صرف آدمی کی مسئولیت کو بڑھاتا ہے۔ اور آدمی اپنی نادانی سے یہ سمجھتا ہے کہ وہ اپنی کامیابی میں اضافہ کر رہا ہے۔"
      ]
    },
    "themes": [
      "resurrection",
      "death-reminder",
      "knowledge"
    ],
    "related": []
  },
  {
    "id": "100:10",
    "surah": "100",
    "number": 10,
    "globalNumber": 6156,
    "bismillah": false,
    "arabic": "وَحُصِّلَ مَا فِي ٱلصُّدُورِ",
    "urdu": "اور سینوں میں جو کچھ (مخفی) ہے اُسے برآمد کر کے اس کی جانچ پڑتال کی جائے گی؟",
    "english": "And that within the breasts is obtained",
    "tafsir": {
      "source": "Bayan ul Quran",
      "paragraphs": [
        "آدمی چاہتا ہے کہ وہ زیادہ سے زیادہ کمائے، وہ زیادہ سے زیادہ سازوسامان اپنے پاس جمع کرے۔ وہ اسی دھن میں لگا رہتا ہے۔ یہاں تک کہ اس کی موت آجاتی ہے۔ اس وقت اس کو معلوم ہوتا ہے کہ جمع کرنے کی چیز تو دوسری تھی اور میں کسی اور چیز کو جمع کرنے میں مصروف رہا۔",
        "دنیا کی چیزوں کا اضافہ صرف آدمی کی مسئولیت کو بڑھاتا ہے۔ اور آدمی اپنی نادانی سے یہ سمجھتا ہے کہ وہ اپنی کامیابی میں اضافہ کر رہا ہے۔"
      ]
    },
    "themes": [
      "akhirah",
      "tazkiyah",
      "knowledge"
    ],
    "related": []
  },
  {
    "id": "100:11",
    "surah": "100",
    "number": 11,
    "globalNumber": 6157,
    "bismillah": false,
    "arabic": "إِنَّ رَبَّهُم بِهِمۡ يَوۡمَئِذٖ لَّخَبِيرُۢ",
    "urdu": "یقیناً اُن کا رب اُس روز اُن سے خوب باخبر ہوگا",
    "english": "Indeed, their Lord with them, that Day, is [fully] Acquainted",
    "tafsir": {
      "source": "Bayan ul Quran",
      "paragraphs": [
        "آدمی چاہتا ہے کہ وہ زیادہ سے زیادہ کمائے، وہ زیادہ سے زیادہ سازوسامان اپنے پاس جمع کرے۔ وہ اسی دھن میں لگا رہتا ہے۔ یہاں تک کہ اس کی موت آجاتی ہے۔ اس وقت اس کو معلوم ہوتا ہے کہ جمع کرنے کی چیز تو دوسری تھی اور میں کسی اور چیز کو جمع کرنے میں مصروف رہا۔",
        "دنیا کی چیزوں کا اضافہ صرف آدمی کی مسئولیت کو بڑھاتا ہے۔ اور آدمی اپنی نادانی سے یہ سمجھتا ہے کہ وہ اپنی کامیابی میں اضافہ کر رہا ہے۔"
      ]
    },
    "themes": [
      "akhirah",
      "knowledge",
      "adl"
    ],
    "related": []
  }
]
