[
  {
    "id": "94:1",
    "surah": "94",
    "number": 1,
    "globalNumber": 6091,
    "bismillah": true,
    "arabic": "أَلَمۡ نَشۡرَحۡ لَكَ صَدۡرَكَ",
    "urdu": "(اے نبیؐ) کیا ہم نے تمہارا سینہ تمہارے لیے کھول نہیں دیا؟",
    "english": "Did We not expand for you, [O Muhammad], your breast",
    "tafsir": {
      "source": "Bayan ul Quran",
      "paragraphs": [
        "رسول اللہ صلی اللہ علیہ وسلم حقیقت جاننے کے لیے تڑپ رہے تھے۔ اللہ تعالیٰ نے آپ کو حقیقت کا علم دے کر آپ کی تلاش کو معرفت میں تبدیل کردیا۔ حقائق کی معرفت کے لیے آپ کا سینہ کھل گیا۔ پھر آپ نے مکہ میں توحید کی دعوت شروع کی تو بظاہر سخت مخالفتوں کا سامنا پیش آیا۔ مگر انہیں مخالفتوں کے ذریعہ یہ ہوا کہ آپ  کا چرچا سارے ملک میں پھیل گیا۔",
        "یہی موجودہ دنیا کے لیے اللہ کا قانون ہے۔ یہاں ابتداء ً انسان کے ساتھ عسر کے حالات پیش آتے ہیں۔ لیکن اگر وہ صبر کے ساتھ اس پر جما رہے تو یہ عسر اس کے لیے نئے یسر تک پہنچنے کا زینہ بن جاتا ہے۔ اس لیے انسان کو چاہيے کہ وہ ہمیشہ اللہ کی طرف دیکھے، وہ اپنی استطاعت کے بقدر اپنی جدوجہد کو برابر جاری رکھے۔"
      ]
    },
    "themes": [
      "story-muhammad",
      "anxiety-fear",
      "rahmah"
    ],
    "related": []
  },
  {
    "id": "94:2",
    "surah": "94",
    "number": 2,
    "globalNumber": 6092,
    "bismillah": false,
    "arabic": "وَوَضَعۡنَا عَنكَ وِزۡرَكَ",
    "urdu": "اور تم پر سے وہ بھاری بوجھ اتار دیا",
    "english": "And We removed from you your burden",
    "tafsir": {
      "source": "Bayan ul Quran",
      "paragraphs": [
        "رسول اللہ صلی اللہ علیہ وسلم حقیقت جاننے کے لیے تڑپ رہے تھے۔ اللہ تعالیٰ نے آپ کو حقیقت کا علم دے کر آپ کی تلاش کو معرفت میں تبدیل کردیا۔ حقائق کی معرفت کے لیے آپ کا سینہ کھل گیا۔ پھر آپ نے مکہ میں توحید کی دعوت شروع کی تو بظاہر سخت مخالفتوں کا سامنا پیش آیا۔ مگر انہیں مخالفتوں کے ذریعہ یہ ہوا کہ آپ  کا چرچا سارے ملک میں پھیل گیا۔",
        "یہی موجودہ دنیا کے لیے اللہ کا قانون ہے۔ یہاں ابتداء ً انسان کے ساتھ عسر کے حالات پیش آتے ہیں۔ لیکن اگر وہ صبر کے ساتھ اس پر جما رہے تو یہ عسر اس کے لیے نئے یسر تک پہنچنے کا زینہ بن جاتا ہے۔ اس لیے انسان کو چاہيے کہ وہ ہمیشہ اللہ کی طرف دیکھے، وہ اپنی استطاعت کے بقدر اپنی جدوجہد کو برابر جاری رکھے۔"
      ]
    },
    "themes": [
      "story-muhammad",
      "rahmah",
      "anxiety-fear"
    ],
    "related": []
  },
  {
    "id": "94:3",
    "surah": "94",
    "number": 3,
    "globalNumber": 6093,
    "bismillah": false,
    "arabic": "ٱلَّذِيٓ أَنقَضَ ظَهۡرَكَ",
    "urdu": "جو تمہاری کمر توڑے ڈال رہا تھا",
    "english": "Which had weighed upon your back",
    "tafsir": {
      "source": "Bayan ul Quran",
      "paragraphs": [
        "رسول اللہ صلی اللہ علیہ وسلم حقیقت جاننے کے لیے تڑپ رہے تھے۔ اللہ تعالیٰ نے آپ کو حقیقت کا علم دے کر آپ کی تلاش کو معرفت میں تبدیل کردیا۔ حقائق کی معرفت کے لیے آپ کا سینہ کھل گیا۔ پھر آپ نے مکہ میں توحید کی دعوت شروع کی تو بظاہر سخت مخالفتوں کا سامنا پیش آیا۔ مگر انہیں مخالفتوں کے ذریعہ یہ ہوا کہ آپ  کا چرچا سارے ملک میں پھیل گیا۔",
        "یہی موجودہ دنیا کے لیے اللہ کا قانون ہے۔ یہاں ابتداء ً انسان کے ساتھ عسر کے حالات پیش آتے ہیں۔ لیکن اگر وہ صبر کے ساتھ اس پر جما رہے تو یہ عسر اس کے لیے نئے یسر تک پہنچنے کا زینہ بن جاتا ہے۔ اس لیے انسان کو چاہيے کہ وہ ہمیشہ اللہ کی طرف دیکھے، وہ اپنی استطاعت کے بقدر اپنی جدوجہد کو برابر جاری رکھے۔"
      ]
    },
    "themes": [
      "story-muhammad",
      "rahmah"
    ],
    "related": []
  },
  {
    "id": "94:4",
    "surah": "94",
    "number": 4,
    "globalNumber": 6094,
    "bismillah": false,
    "arabic": "وَرَفَعۡنَا لَكَ ذِكۡرَكَ",
    "urdu": "اور تمہاری خاطر تمہارے ذکر کا آوازہ بلند کر دیا",
    "english": "And raised high for you your repute",
    "tafsir": {
      "source": "Bayan ul Quran",
      "paragraphs": [
        "رسول اللہ صلی اللہ علیہ وسلم حقیقت جاننے کے لیے تڑپ رہے تھے۔ اللہ تعالیٰ نے آپ کو حقیقت کا علم دے کر آپ کی تلاش کو معرفت میں تبدیل کردیا۔ حقائق کی معرفت کے لیے آپ کا سینہ کھل گیا۔ پھر آپ نے مکہ میں توحید کی دعوت شروع کی تو بظاہر سخت مخالفتوں کا سامنا پیش آیا۔ مگر انہیں مخالفتوں کے ذریعہ یہ ہوا کہ آپ  کا چرچا سارے ملک میں پھیل گیا۔",
        "یہی موجودہ دنیا کے لیے اللہ کا قانون ہے۔ یہاں ابتداء ً انسان کے ساتھ عسر کے حالات پیش آتے ہیں۔ لیکن اگر وہ صبر کے ساتھ اس پر جما رہے تو یہ عسر اس کے لیے نئے یسر تک پہنچنے کا زینہ بن جاتا ہے۔ اس لیے انسان کو چاہيے کہ وہ ہمیشہ اللہ کی طرف دیکھے، وہ اپنی استطاعت کے بقدر اپنی جدوجہد کو برابر جاری رکھے۔"
      ]
    },
    "themes": [
      "story-muhammad",
      "dhikr",
      "glad-tidings"
    ],
    "related": []
  },
  {
    "id": "94:5",
    "surah": "94",
    "number": 5,
    "globalNumber": 6095,
    "bismillah": false,
    "arabic": "فَإِنَّ مَعَ ٱلۡعُسۡرِ يُسۡرًا",
    "urdu": "پس حقیقت یہ ہے کہ تنگی کے ساتھ فراخی بھی ہے",
    "english": "For indeed, with hardship [will be] ease",
    "tafsir": {
      "source": "Bayan ul Quran",
      "paragraphs": [
        "رسول اللہ صلی اللہ علیہ وسلم حقیقت جاننے کے لیے تڑپ رہے تھے۔ اللہ تعالیٰ نے آپ کو حقیقت کا علم دے کر آپ کی تلاش کو معرفت میں تبدیل کردیا۔ حقائق کی معرفت کے لیے آپ کا سینہ کھل گیا۔ پھر آپ نے مکہ میں توحید کی دعوت شروع کی تو بظاہر سخت مخالفتوں کا سامنا پیش آیا۔ مگر انہیں مخالفتوں کے ذریعہ یہ ہوا کہ آپ  کا چرچا سارے ملک میں پھیل گیا۔",
        "یہی موجودہ دنیا کے لیے اللہ کا قانون ہے۔ یہاں ابتداء ً انسان کے ساتھ عسر کے حالات پیش آتے ہیں۔ لیکن اگر وہ صبر کے ساتھ اس پر جما رہے تو یہ عسر اس کے لیے نئے یسر تک پہنچنے کا زینہ بن جاتا ہے۔ اس لیے انسان کو چاہيے کہ وہ ہمیشہ اللہ کی طرف دیکھے، وہ اپنی استطاعت کے بقدر اپنی جدوجہد کو برابر جاری رکھے۔"
      ]
    },
    "themes": [
      "glad-tidings",
      "sabr",
      "hope-raja"
    ],
    "related": []
  },
  {
    "id": "94:6",
    "surah": "94",
    "number": 6,
    "globalNumber": 6096,
    "bismillah": false,
    "arabic": "إِنَّ مَعَ ٱلۡعُسۡرِ يُسۡرٗا",
    "urdu": "بے شک تنگی کے ساتھ فراخی بھی ہے",
    "english": "Indeed, with hardship [will be] ease",
    "tafsir": {
      "source": "Bayan ul Quran",
      "paragraphs": [
        "رسول اللہ صلی اللہ علیہ وسلم حقیقت جاننے کے لیے تڑپ رہے تھے۔ اللہ تعالیٰ نے آپ کو حقیقت کا علم دے کر آپ کی تلاش کو معرفت میں تبدیل کردیا۔ حقائق کی معرفت کے لیے آپ کا سینہ کھل گیا۔ پھر آپ نے مکہ میں توحید کی دعوت شروع کی تو بظاہر سخت مخالفتوں کا سامنا پیش آیا۔ مگر انہیں مخالفتوں کے ذریعہ یہ ہوا کہ آپ  کا چرچا سارے ملک میں پھیل گیا۔",
        "یہی موجودہ دنیا کے لیے اللہ کا قانون ہے۔ یہاں ابتداء ً انسان کے ساتھ عسر کے حالات پیش آتے ہیں۔ لیکن اگر وہ صبر کے ساتھ اس پر جما رہے تو یہ عسر اس کے لیے نئے یسر تک پہنچنے کا زینہ بن جاتا ہے۔ اس لیے انسان کو چاہيے کہ وہ ہمیشہ اللہ کی طرف دیکھے، وہ اپنی استطاعت کے بقدر اپنی جدوجہد کو برابر جاری رکھے۔"
      ]
    },
    "themes": [
      "glad-tidings",
      "sabr",
      "hope-raja"
    ],
    "related": []
  },
  {
    "id": "94:7",
    "surah": "94",
    "number": 7,
    "globalNumber": 6097,
    "bismillah": false,
    "arabic": "فَإِذَا فَرَغۡتَ فَٱنصَبۡ",
    "urdu": "لہٰذا جب تم فارغ ہو تو عبادت کی مشقت میں لگ جاؤ",
    "english": "So when you have finished [your duties], then stand up [for worship]",
    "tafsir": {
      "source": "Bayan ul Quran",
      "paragraphs": [
        "رسول اللہ صلی اللہ علیہ وسلم حقیقت جاننے کے لیے تڑپ رہے تھے۔ اللہ تعالیٰ نے آپ کو حقیقت کا علم دے کر آپ کی تلاش کو معرفت میں تبدیل کردیا۔ حقائق کی معرفت کے لیے آپ کا سینہ کھل گیا۔ پھر آپ نے مکہ میں توحید کی دعوت شروع کی تو بظاہر سخت مخالفتوں کا سامنا پیش آیا۔ مگر انہیں مخالفتوں کے ذریعہ یہ ہوا کہ آپ  کا چرچا سارے ملک میں پھیل گیا۔",
        "یہی موجودہ دنیا کے لیے اللہ کا قانون ہے۔ یہاں ابتداء ً انسان کے ساتھ عسر کے حالات پیش آتے ہیں۔ لیکن اگر وہ صبر کے ساتھ اس پر جما رہے تو یہ عسر اس کے لیے نئے یسر تک پہنچنے کا زینہ بن جاتا ہے۔ اس لیے انسان کو چاہيے کہ وہ ہمیشہ اللہ کی طرف دیکھے، وہ اپنی استطاعت کے بقدر اپنی جدوجہد کو برابر جاری رکھے۔"
      ]
    },
    "themes": [
      "work-ethics",
      "commands"
    ],
    "related": []
  },
  {
    "id": "94:8",
    "surah": "94",
    "number": 8,
    "globalNumber": 6098,
    "bismillah": false,
    "arabic": "وَإِلَىٰ رَبِّكَ فَٱرۡغَب",
    "urdu": "اور اپنے رب ہی کی طرف راغب ہو",
    "english": "And to your Lord direct [your] longing",
    "tafsir": {
      "source": "Bayan ul Quran",
      "paragraphs": [
        "رسول اللہ صلی اللہ علیہ وسلم حقیقت جاننے کے لیے تڑپ رہے تھے۔ اللہ تعالیٰ نے آپ کو حقیقت کا علم دے کر آپ کی تلاش کو معرفت میں تبدیل کردیا۔ حقائق کی معرفت کے لیے آپ کا سینہ کھل گیا۔ پھر آپ نے مکہ میں توحید کی دعوت شروع کی تو بظاہر سخت مخالفتوں کا سامنا پیش آیا۔ مگر انہیں مخالفتوں کے ذریعہ یہ ہوا کہ آپ  کا چرچا سارے ملک میں پھیل گیا۔",
        "یہی موجودہ دنیا کے لیے اللہ کا قانون ہے۔ یہاں ابتداء ً انسان کے ساتھ عسر کے حالات پیش آتے ہیں۔ لیکن اگر وہ صبر کے ساتھ اس پر جما رہے تو یہ عسر اس کے لیے نئے یسر تک پہنچنے کا زینہ بن جاتا ہے۔ اس لیے انسان کو چاہيے کہ وہ ہمیشہ اللہ کی طرف دیکھے، وہ اپنی استطاعت کے بقدر اپنی جدوجہد کو برابر جاری رکھے۔"
      ]
    },
    "themes": [
      "dhikr",
      "ikhlas",
      "commands"
    ],
    "related": []
  }
]
