[
  {
    "id": "112:1",
    "surah": "112",
    "number": 1,
    "globalNumber": 6222,
    "bismillah": true,
    "arabic": "قُلۡ هُوَ ٱللَّهُ أَحَدٌ",
    "urdu": "کہو، وہ اللہ ہے، یکتا",
    "english": "Say, \"He is Allah, [who is] One",
    "tafsir": {
      "source": "Bayan ul Quran",
      "paragraphs": [
        "یہ سورہ توحید کی سورہ ہے۔ اس میں خدا کے تصور کو ان تمام آمیزشوں سے الگ کرکے پیش کیا گیا ہے جس میں ہر زمانہ کا انسان مبتلا رہا ہے— خدا کئی نہیں، خدا صرف ایک ہے۔ سب اس کے محتاج ہیں، وہ کسی کا محتاج نہیں، وہ بذات خود ہر چیز پر قادر ہے۔ وہ اس سے بلند ہے کہ انسانوں کی طرح وہ کسی کی اولاد ہو یا اس کی کوئی اولاد ہو۔ وہ ایسی یکتا ذات ہے جس کا کسی بھی اعتبار سے کوئی مثل اور برابر نہیں۔"
      ]
    },
    "themes": [
      "tawheed",
      "ikhlas",
      "asma-ul-husna"
    ],
    "related": []
  },
  {
    "id": "112:2",
    "surah": "112",
    "number": 2,
    "globalNumber": 6223,
    "bismillah": false,
    "arabic": "ٱللَّهُ ٱلصَّمَدُ",
    "urdu": "اللہ سب سے بے نیاز ہے اور سب اس کے محتاج ہیں",
    "english": "Allah, the Eternal Refuge",
    "tafsir": {
      "source": "Bayan ul Quran",
      "paragraphs": [
        "یہ سورہ توحید کی سورہ ہے۔ اس میں خدا کے تصور کو ان تمام آمیزشوں سے الگ کرکے پیش کیا گیا ہے جس میں ہر زمانہ کا انسان مبتلا رہا ہے— خدا کئی نہیں، خدا صرف ایک ہے۔ سب اس کے محتاج ہیں، وہ کسی کا محتاج نہیں، وہ بذات خود ہر چیز پر قادر ہے۔ وہ اس سے بلند ہے کہ انسانوں کی طرح وہ کسی کی اولاد ہو یا اس کی کوئی اولاد ہو۔ وہ ایسی یکتا ذات ہے جس کا کسی بھی اعتبار سے کوئی مثل اور برابر نہیں۔"
      ]
    },
    "themes": [
      "tawheed",
      "asma-ul-husna",
      "tawakkul"
    ],
    "related": []
  },
  {
    "id": "112:3",
    "surah": "112",
    "number": 3,
    "globalNumber": 6224,
    "bismillah": false,
    "arabic": "لَمۡ يَلِدۡ وَلَمۡ يُولَدۡ",
    "urdu": "نہ اس کی کوئی اولاد ہے اور نہ وہ کسی کی اولاد",
    "english": "He neither begets nor is born",
    "tafsir": {
      "source": "Bayan ul Quran",
      "paragraphs": [
        "یہ سورہ توحید کی سورہ ہے۔ اس میں خدا کے تصور کو ان تمام آمیزشوں سے الگ کرکے پیش کیا گیا ہے جس میں ہر زمانہ کا انسان مبتلا رہا ہے— خدا کئی نہیں، خدا صرف ایک ہے۔ سب اس کے محتاج ہیں، وہ کسی کا محتاج نہیں، وہ بذات خود ہر چیز پر قادر ہے۔ وہ اس سے بلند ہے کہ انسانوں کی طرح وہ کسی کی اولاد ہو یا اس کی کوئی اولاد ہو۔ وہ ایسی یکتا ذات ہے جس کا کسی بھی اعتبار سے کوئی مثل اور برابر نہیں۔"
      ]
    },
    "themes": [
      "tawheed",
      "asma-ul-husna",
      "shirk"
    ],
    "related": []
  },
  {
    "id": "112:4",
    "surah": "112",
    "number": 4,
    "globalNumber": 6225,
    "bismillah": false,
    "arabic": "وَلَمۡ يَكُن لَّهُۥ كُفُوًا أَحَدُۢ",
    "urdu": "اور کوئی اس کا ہمسر نہیں ہے",
    "english": "Nor is there to Him any equivalent",
    "tafsir": {
      "source": "Bayan ul Quran",
      "paragraphs": [
        "یہ سورہ توحید کی سورہ ہے۔ اس میں خدا کے تصور کو ان تمام آمیزشوں سے الگ کرکے پیش کیا گیا ہے جس میں ہر زمانہ کا انسان مبتلا رہا ہے— خدا کئی نہیں، خدا صرف ایک ہے۔ سب اس کے محتاج ہیں، وہ کسی کا محتاج نہیں، وہ بذات خود ہر چیز پر قادر ہے۔ وہ اس سے بلند ہے کہ انسانوں کی طرح وہ کسی کی اولاد ہو یا اس کی کوئی اولاد ہو۔ وہ ایسی یکتا ذات ہے جس کا کسی بھی اعتبار سے کوئی مثل اور برابر نہیں۔"
      ]
    },
    "themes": [
      "tawheed",
      "asma-ul-husna",
      "shirk"
    ],
    "related": []
  }
]
