[
  {
    "id": "99:1",
    "surah": "99",
    "number": 1,
    "globalNumber": 6139,
    "bismillah": true,
    "arabic": "إِذَا زُلۡزِلَتِ ٱلۡأَرۡضُ زِلۡزَالَهَا",
    "urdu": "جب زمین اپنی پوری شدت کے ساتھ ہلا ڈالی جائے گی",
    "english": "When the earth is shaken with its [final] earthquake",
    "tafsir": {
      "source": "Bayan ul Quran",
      "paragraphs": [
        "قیامت کا زلزلہ مدتِ امتحان کے ختم ہونے کا اعلان ہوگا۔ اس کا مطلب یہ ہوگا کہ اب لوگوں سے وہ آزادی چھن گئی جو امتحان کی مصلحت کی بنا پر انہیں حاصل تھی۔ اب وہ وقت آگیا جب لوگوں کو ان کے عمل کا بدلہ دیا جائے۔ آج خداکی دنیا بظاہر خاموش ہے۔ مگر جب حالات بدلیں گے تو یہاں کی ہر چیز بولنے لگے گی۔ موجودہ زمانہ کی ایجادات نے ثابت کیا ہے کہ بے جان چیزیں بھی ’’بولنے’’ کی صلاحیت رکھتی ہیں۔ اسٹوڈیو میں کیے ہوئے عمل کو فلم اور ریکارڈ پوری طرح دہرا دیتے ہیں۔ اسی طرح موجودہ دنیا گویا بہت بڑا خدائی اسٹوڈیو ہے۔ اس کے اندر انسان جو کچھ کرتا ہے یا جو کچھ بولتا ہے وہ سب ہر لمحہ محفوظ ہورہا ہے۔ اور جب وقت آئے گا تو ہر ایک کی کہانی کو یہ دنیا اس طرح دہرا دے گی کہ اس کی کوئی بھی بات اس سے بچی ہوئی نہ ہوگی، خواہ وہ چھوٹی ہو یا بڑی۔"
      ]
    },
    "themes": [
      "akhirah",
      "resurrection",
      "nature-signs"
    ],
    "related": []
  },
  {
    "id": "99:2",
    "surah": "99",
    "number": 2,
    "globalNumber": 6140,
    "bismillah": false,
    "arabic": "وَأَخۡرَجَتِ ٱلۡأَرۡضُ أَثۡقَالَهَا",
    "urdu": "اور زمین اپنے اندر کے سارے بوجھ نکال کر باہر ڈال دے گی",
    "english": "And the earth discharges its burdens",
    "tafsir": {
      "source": "Bayan ul Quran",
      "paragraphs": [
        "قیامت کا زلزلہ مدتِ امتحان کے ختم ہونے کا اعلان ہوگا۔ اس کا مطلب یہ ہوگا کہ اب لوگوں سے وہ آزادی چھن گئی جو امتحان کی مصلحت کی بنا پر انہیں حاصل تھی۔ اب وہ وقت آگیا جب لوگوں کو ان کے عمل کا بدلہ دیا جائے۔ آج خداکی دنیا بظاہر خاموش ہے۔ مگر جب حالات بدلیں گے تو یہاں کی ہر چیز بولنے لگے گی۔ موجودہ زمانہ کی ایجادات نے ثابت کیا ہے کہ بے جان چیزیں بھی ’’بولنے’’ کی صلاحیت رکھتی ہیں۔ اسٹوڈیو میں کیے ہوئے عمل کو فلم اور ریکارڈ پوری طرح دہرا دیتے ہیں۔ اسی طرح موجودہ دنیا گویا بہت بڑا خدائی اسٹوڈیو ہے۔ اس کے اندر انسان جو کچھ کرتا ہے یا جو کچھ بولتا ہے وہ سب ہر لمحہ محفوظ ہورہا ہے۔ اور جب وقت آئے گا تو ہر ایک کی کہانی کو یہ دنیا اس طرح دہرا دے گی کہ اس کی کوئی بھی بات اس سے بچی ہوئی نہ ہوگی، خواہ وہ چھوٹی ہو یا بڑی۔"
      ]
    },
    "themes": [
      "akhirah",
      "resurrection"
    ],
    "related": []
  },
  {
    "id": "99:3",
    "surah": "99",
    "number": 3,
    "globalNumber": 6141,
    "bismillah": false,
    "arabic": "وَقَالَ ٱلۡإِنسَٰنُ مَا لَهَا",
    "urdu": "اور انسان کہے گا کہ یہ اِس کو کیا ہو رہا ہے",
    "english": "And man says, \"What is [wrong] with it",
    "tafsir": {
      "source": "Bayan ul Quran",
      "paragraphs": [
        "قیامت کا زلزلہ مدتِ امتحان کے ختم ہونے کا اعلان ہوگا۔ اس کا مطلب یہ ہوگا کہ اب لوگوں سے وہ آزادی چھن گئی جو امتحان کی مصلحت کی بنا پر انہیں حاصل تھی۔ اب وہ وقت آگیا جب لوگوں کو ان کے عمل کا بدلہ دیا جائے۔ آج خداکی دنیا بظاہر خاموش ہے۔ مگر جب حالات بدلیں گے تو یہاں کی ہر چیز بولنے لگے گی۔ موجودہ زمانہ کی ایجادات نے ثابت کیا ہے کہ بے جان چیزیں بھی ’’بولنے’’ کی صلاحیت رکھتی ہیں۔ اسٹوڈیو میں کیے ہوئے عمل کو فلم اور ریکارڈ پوری طرح دہرا دیتے ہیں۔ اسی طرح موجودہ دنیا گویا بہت بڑا خدائی اسٹوڈیو ہے۔ اس کے اندر انسان جو کچھ کرتا ہے یا جو کچھ بولتا ہے وہ سب ہر لمحہ محفوظ ہورہا ہے۔ اور جب وقت آئے گا تو ہر ایک کی کہانی کو یہ دنیا اس طرح دہرا دے گی کہ اس کی کوئی بھی بات اس سے بچی ہوئی نہ ہوگی، خواہ وہ چھوٹی ہو یا بڑی۔"
      ]
    },
    "themes": [
      "akhirah",
      "human-creation"
    ],
    "related": []
  },
  {
    "id": "99:4",
    "surah": "99",
    "number": 4,
    "globalNumber": 6142,
    "bismillah": false,
    "arabic": "يَوۡمَئِذٖ تُحَدِّثُ أَخۡبَارَهَا",
    "urdu": "اُس روز وہ اپنے (اوپر گزرے ہوئے) حالات بیان کرے گی",
    "english": "That Day, it will report its news",
    "tafsir": {
      "source": "Bayan ul Quran",
      "paragraphs": [
        "قیامت کا زلزلہ مدتِ امتحان کے ختم ہونے کا اعلان ہوگا۔ اس کا مطلب یہ ہوگا کہ اب لوگوں سے وہ آزادی چھن گئی جو امتحان کی مصلحت کی بنا پر انہیں حاصل تھی۔ اب وہ وقت آگیا جب لوگوں کو ان کے عمل کا بدلہ دیا جائے۔ آج خداکی دنیا بظاہر خاموش ہے۔ مگر جب حالات بدلیں گے تو یہاں کی ہر چیز بولنے لگے گی۔ موجودہ زمانہ کی ایجادات نے ثابت کیا ہے کہ بے جان چیزیں بھی ’’بولنے’’ کی صلاحیت رکھتی ہیں۔ اسٹوڈیو میں کیے ہوئے عمل کو فلم اور ریکارڈ پوری طرح دہرا دیتے ہیں۔ اسی طرح موجودہ دنیا گویا بہت بڑا خدائی اسٹوڈیو ہے۔ اس کے اندر انسان جو کچھ کرتا ہے یا جو کچھ بولتا ہے وہ سب ہر لمحہ محفوظ ہورہا ہے۔ اور جب وقت آئے گا تو ہر ایک کی کہانی کو یہ دنیا اس طرح دہرا دے گی کہ اس کی کوئی بھی بات اس سے بچی ہوئی نہ ہوگی، خواہ وہ چھوٹی ہو یا بڑی۔"
      ]
    },
    "themes": [
      "akhirah",
      "qadr"
    ],
    "related": []
  },
  {
    "id": "99:5",
    "surah": "99",
    "number": 5,
    "globalNumber": 6143,
    "bismillah": false,
    "arabic": "بِأَنَّ رَبَّكَ أَوۡحَىٰ لَهَا",
    "urdu": "کیونکہ تیرے رب نے اُسے (ایساکرنے کا) حکم دیا ہوگا",
    "english": "Because your Lord has commanded it",
    "tafsir": {
      "source": "Bayan ul Quran",
      "paragraphs": [
        "قیامت کا زلزلہ مدتِ امتحان کے ختم ہونے کا اعلان ہوگا۔ اس کا مطلب یہ ہوگا کہ اب لوگوں سے وہ آزادی چھن گئی جو امتحان کی مصلحت کی بنا پر انہیں حاصل تھی۔ اب وہ وقت آگیا جب لوگوں کو ان کے عمل کا بدلہ دیا جائے۔ آج خداکی دنیا بظاہر خاموش ہے۔ مگر جب حالات بدلیں گے تو یہاں کی ہر چیز بولنے لگے گی۔ موجودہ زمانہ کی ایجادات نے ثابت کیا ہے کہ بے جان چیزیں بھی ’’بولنے’’ کی صلاحیت رکھتی ہیں۔ اسٹوڈیو میں کیے ہوئے عمل کو فلم اور ریکارڈ پوری طرح دہرا دیتے ہیں۔ اسی طرح موجودہ دنیا گویا بہت بڑا خدائی اسٹوڈیو ہے۔ اس کے اندر انسان جو کچھ کرتا ہے یا جو کچھ بولتا ہے وہ سب ہر لمحہ محفوظ ہورہا ہے۔ اور جب وقت آئے گا تو ہر ایک کی کہانی کو یہ دنیا اس طرح دہرا دے گی کہ اس کی کوئی بھی بات اس سے بچی ہوئی نہ ہوگی، خواہ وہ چھوٹی ہو یا بڑی۔"
      ]
    },
    "themes": [
      "akhirah",
      "qadr"
    ],
    "related": []
  },
  {
    "id": "99:6",
    "surah": "99",
    "number": 6,
    "globalNumber": 6144,
    "bismillah": false,
    "arabic": "يَوۡمَئِذٖ يَصۡدُرُ ٱلنَّاسُ أَشۡتَاتٗا لِّيُرَوۡاْ أَعۡمَٰلَهُمۡ",
    "urdu": "اُس روز لوگ متفرق حالت میں پلٹیں گے تاکہ اُن کے اعمال اُن کو دکھائے جائیں",
    "english": "That Day, the people will depart separated [into categories] to be shown [the result of] their deeds",
    "tafsir": {
      "source": "Bayan ul Quran",
      "paragraphs": [
        "قیامت کا زلزلہ مدتِ امتحان کے ختم ہونے کا اعلان ہوگا۔ اس کا مطلب یہ ہوگا کہ اب لوگوں سے وہ آزادی چھن گئی جو امتحان کی مصلحت کی بنا پر انہیں حاصل تھی۔ اب وہ وقت آگیا جب لوگوں کو ان کے عمل کا بدلہ دیا جائے۔ آج خداکی دنیا بظاہر خاموش ہے۔ مگر جب حالات بدلیں گے تو یہاں کی ہر چیز بولنے لگے گی۔ موجودہ زمانہ کی ایجادات نے ثابت کیا ہے کہ بے جان چیزیں بھی ’’بولنے’’ کی صلاحیت رکھتی ہیں۔ اسٹوڈیو میں کیے ہوئے عمل کو فلم اور ریکارڈ پوری طرح دہرا دیتے ہیں۔ اسی طرح موجودہ دنیا گویا بہت بڑا خدائی اسٹوڈیو ہے۔ اس کے اندر انسان جو کچھ کرتا ہے یا جو کچھ بولتا ہے وہ سب ہر لمحہ محفوظ ہورہا ہے۔ اور جب وقت آئے گا تو ہر ایک کی کہانی کو یہ دنیا اس طرح دہرا دے گی کہ اس کی کوئی بھی بات اس سے بچی ہوئی نہ ہوگی، خواہ وہ چھوٹی ہو یا بڑی۔"
      ]
    },
    "themes": [
      "akhirah",
      "adl"
    ],
    "related": []
  },
  {
    "id": "99:7",
    "surah": "99",
    "number": 7,
    "globalNumber": 6145,
    "bismillah": false,
    "arabic": "فَمَن يَعۡمَلۡ مِثۡقَالَ ذَرَّةٍ خَيۡرٗا يَرَهُۥ",
    "urdu": "پھر جس نے ذرہ برابر نیکی کی ہوگی وہ اس کو دیکھ لے گا",
    "english": "So whoever does an atom's weight of good will see it",
    "tafsir": {
      "source": "Bayan ul Quran",
      "paragraphs": [
        "قیامت کا زلزلہ مدتِ امتحان کے ختم ہونے کا اعلان ہوگا۔ اس کا مطلب یہ ہوگا کہ اب لوگوں سے وہ آزادی چھن گئی جو امتحان کی مصلحت کی بنا پر انہیں حاصل تھی۔ اب وہ وقت آگیا جب لوگوں کو ان کے عمل کا بدلہ دیا جائے۔ آج خداکی دنیا بظاہر خاموش ہے۔ مگر جب حالات بدلیں گے تو یہاں کی ہر چیز بولنے لگے گی۔ موجودہ زمانہ کی ایجادات نے ثابت کیا ہے کہ بے جان چیزیں بھی ’’بولنے’’ کی صلاحیت رکھتی ہیں۔ اسٹوڈیو میں کیے ہوئے عمل کو فلم اور ریکارڈ پوری طرح دہرا دیتے ہیں۔ اسی طرح موجودہ دنیا گویا بہت بڑا خدائی اسٹوڈیو ہے۔ اس کے اندر انسان جو کچھ کرتا ہے یا جو کچھ بولتا ہے وہ سب ہر لمحہ محفوظ ہورہا ہے۔ اور جب وقت آئے گا تو ہر ایک کی کہانی کو یہ دنیا اس طرح دہرا دے گی کہ اس کی کوئی بھی بات اس سے بچی ہوئی نہ ہوگی، خواہ وہ چھوٹی ہو یا بڑی۔"
      ]
    },
    "themes": [
      "akhirah",
      "adl",
      "ihsan"
    ],
    "related": []
  },
  {
    "id": "99:8",
    "surah": "99",
    "number": 8,
    "globalNumber": 6146,
    "bismillah": false,
    "arabic": "وَمَن يَعۡمَلۡ مِثۡقَالَ ذَرَّةٖ شَرّٗا يَرَهُۥ",
    "urdu": "اور جس نے ذرہ برابر بدی کی ہوگی وہ اس کو دیکھ لے گا",
    "english": "And whoever does an atom's weight of evil will see it",
    "tafsir": {
      "source": "Bayan ul Quran",
      "paragraphs": [
        "قیامت کا زلزلہ مدتِ امتحان کے ختم ہونے کا اعلان ہوگا۔ اس کا مطلب یہ ہوگا کہ اب لوگوں سے وہ آزادی چھن گئی جو امتحان کی مصلحت کی بنا پر انہیں حاصل تھی۔ اب وہ وقت آگیا جب لوگوں کو ان کے عمل کا بدلہ دیا جائے۔ آج خداکی دنیا بظاہر خاموش ہے۔ مگر جب حالات بدلیں گے تو یہاں کی ہر چیز بولنے لگے گی۔ موجودہ زمانہ کی ایجادات نے ثابت کیا ہے کہ بے جان چیزیں بھی ’’بولنے’’ کی صلاحیت رکھتی ہیں۔ اسٹوڈیو میں کیے ہوئے عمل کو فلم اور ریکارڈ پوری طرح دہرا دیتے ہیں۔ اسی طرح موجودہ دنیا گویا بہت بڑا خدائی اسٹوڈیو ہے۔ اس کے اندر انسان جو کچھ کرتا ہے یا جو کچھ بولتا ہے وہ سب ہر لمحہ محفوظ ہورہا ہے۔ اور جب وقت آئے گا تو ہر ایک کی کہانی کو یہ دنیا اس طرح دہرا دے گی کہ اس کی کوئی بھی بات اس سے بچی ہوئی نہ ہوگی، خواہ وہ چھوٹی ہو یا بڑی۔"
      ]
    },
    "themes": [
      "akhirah",
      "adl",
      "warnings"
    ],
    "related": []
  }
]
