[
  {
    "id": "97:1",
    "surah": "97",
    "number": 1,
    "globalNumber": 6126,
    "bismillah": true,
    "arabic": "إِنَّآ أَنزَلۡنَٰهُ فِي لَيۡلَةِ ٱلۡقَدۡرِ",
    "urdu": "ہم نے اِس (قرآن) کو شب قدر میں نازل کیا ہے",
    "english": "Indeed, We sent the Qur'an down during the Night of Decree",
    "tafsir": {
      "source": "Bayan ul Quran",
      "paragraphs": [
        "سال کی ایک خاص رات (غالباً ماہ رمضان کے اخیر عشرہ کی کوئی رات) اللہ تعالیٰ کے یہاں فیصلہ کی رات ہے۔ دنیا کے انتظام کے متعلق جو کام اس سال میں مقدر ہیں ان کے نفاذ کی تعیین کے لیے اس رات کو فرشتے اترتے ہیں۔ اس قسم کی ایک خاص رات میں قرآن کا نزول شروع ہوا۔",
        "بظاہر ایسا معلوم ہوتا ہے کہ اس رات کو زمین پر فرشتوں کی کثرت ہوتی ہے۔ اس سے زمین پر خاص طرح کا روحانی ماحول پیدا ہوتا ہے۔ اب جو لوگ اپنے اندر روحانیت بیدار کیے ہوئے ہوں وہ اس سے متاثر ہوتے ہیں اور اس کے نتیجہ میں ان کے اندر غیر معمولی روحانی تاثیر پیدا ہوجاتی ہے جو ان کے دیني عمل کی قدروقیمت عام حالات سے بہت زیادہ بڑھا دیتی ہے۔"
      ]
    },
    "themes": [
      "revelation",
      "time",
      "qadr"
    ],
    "related": []
  },
  {
    "id": "97:2",
    "surah": "97",
    "number": 2,
    "globalNumber": 6127,
    "bismillah": false,
    "arabic": "وَمَآ أَدۡرَىٰكَ مَا لَيۡلَةُ ٱلۡقَدۡرِ",
    "urdu": "اور تم کیا جانو کہ شب قدر کیا ہے؟",
    "english": "And what can make you know what is the Night of Decree",
    "tafsir": {
      "source": "Bayan ul Quran",
      "paragraphs": [
        "سال کی ایک خاص رات (غالباً ماہ رمضان کے اخیر عشرہ کی کوئی رات) اللہ تعالیٰ کے یہاں فیصلہ کی رات ہے۔ دنیا کے انتظام کے متعلق جو کام اس سال میں مقدر ہیں ان کے نفاذ کی تعیین کے لیے اس رات کو فرشتے اترتے ہیں۔ اس قسم کی ایک خاص رات میں قرآن کا نزول شروع ہوا۔",
        "بظاہر ایسا معلوم ہوتا ہے کہ اس رات کو زمین پر فرشتوں کی کثرت ہوتی ہے۔ اس سے زمین پر خاص طرح کا روحانی ماحول پیدا ہوتا ہے۔ اب جو لوگ اپنے اندر روحانیت بیدار کیے ہوئے ہوں وہ اس سے متاثر ہوتے ہیں اور اس کے نتیجہ میں ان کے اندر غیر معمولی روحانی تاثیر پیدا ہوجاتی ہے جو ان کے دیني عمل کی قدروقیمت عام حالات سے بہت زیادہ بڑھا دیتی ہے۔"
      ]
    },
    "themes": [
      "time",
      "revelation"
    ],
    "related": []
  },
  {
    "id": "97:3",
    "surah": "97",
    "number": 3,
    "globalNumber": 6128,
    "bismillah": false,
    "arabic": "لَيۡلَةُ ٱلۡقَدۡرِ خَيۡرٞ مِّنۡ أَلۡفِ شَهۡرٖ",
    "urdu": "شب قدر ہزار مہینوں سے زیادہ بہتر ہے",
    "english": "The Night of Decree is better than a thousand months",
    "tafsir": {
      "source": "Bayan ul Quran",
      "paragraphs": [
        "سال کی ایک خاص رات (غالباً ماہ رمضان کے اخیر عشرہ کی کوئی رات) اللہ تعالیٰ کے یہاں فیصلہ کی رات ہے۔ دنیا کے انتظام کے متعلق جو کام اس سال میں مقدر ہیں ان کے نفاذ کی تعیین کے لیے اس رات کو فرشتے اترتے ہیں۔ اس قسم کی ایک خاص رات میں قرآن کا نزول شروع ہوا۔",
        "بظاہر ایسا معلوم ہوتا ہے کہ اس رات کو زمین پر فرشتوں کی کثرت ہوتی ہے۔ اس سے زمین پر خاص طرح کا روحانی ماحول پیدا ہوتا ہے۔ اب جو لوگ اپنے اندر روحانیت بیدار کیے ہوئے ہوں وہ اس سے متاثر ہوتے ہیں اور اس کے نتیجہ میں ان کے اندر غیر معمولی روحانی تاثیر پیدا ہوجاتی ہے جو ان کے دیني عمل کی قدروقیمت عام حالات سے بہت زیادہ بڑھا دیتی ہے۔"
      ]
    },
    "themes": [
      "time",
      "sawm",
      "glad-tidings"
    ],
    "related": []
  },
  {
    "id": "97:4",
    "surah": "97",
    "number": 4,
    "globalNumber": 6129,
    "bismillah": false,
    "arabic": "تَنَزَّلُ ٱلۡمَلَـٰٓئِكَةُ وَٱلرُّوحُ فِيهَا بِإِذۡنِ رَبِّهِم مِّن كُلِّ أَمۡرٖ",
    "urdu": "فرشتے اور روح اُس میں اپنے رب کے اذن سے ہر حکم لے کر اترتے ہیں",
    "english": "The angels and the Spirit descend therein by permission of their Lord for every matter",
    "tafsir": {
      "source": "Bayan ul Quran",
      "paragraphs": [
        "سال کی ایک خاص رات (غالباً ماہ رمضان کے اخیر عشرہ کی کوئی رات) اللہ تعالیٰ کے یہاں فیصلہ کی رات ہے۔ دنیا کے انتظام کے متعلق جو کام اس سال میں مقدر ہیں ان کے نفاذ کی تعیین کے لیے اس رات کو فرشتے اترتے ہیں۔ اس قسم کی ایک خاص رات میں قرآن کا نزول شروع ہوا۔",
        "بظاہر ایسا معلوم ہوتا ہے کہ اس رات کو زمین پر فرشتوں کی کثرت ہوتی ہے۔ اس سے زمین پر خاص طرح کا روحانی ماحول پیدا ہوتا ہے۔ اب جو لوگ اپنے اندر روحانیت بیدار کیے ہوئے ہوں وہ اس سے متاثر ہوتے ہیں اور اس کے نتیجہ میں ان کے اندر غیر معمولی روحانی تاثیر پیدا ہوجاتی ہے جو ان کے دیني عمل کی قدروقیمت عام حالات سے بہت زیادہ بڑھا دیتی ہے۔"
      ]
    },
    "themes": [
      "angels",
      "qadr",
      "time"
    ],
    "related": []
  },
  {
    "id": "97:5",
    "surah": "97",
    "number": 5,
    "globalNumber": 6130,
    "bismillah": false,
    "arabic": "سَلَٰمٌ هِيَ حَتَّىٰ مَطۡلَعِ ٱلۡفَجۡرِ",
    "urdu": "وہ رات سراسر سلامتی ہے طلوع فجر تک",
    "english": "Peace it is until the emergence of dawn",
    "tafsir": {
      "source": "Bayan ul Quran",
      "paragraphs": [
        "سال کی ایک خاص رات (غالباً ماہ رمضان کے اخیر عشرہ کی کوئی رات) اللہ تعالیٰ کے یہاں فیصلہ کی رات ہے۔ دنیا کے انتظام کے متعلق جو کام اس سال میں مقدر ہیں ان کے نفاذ کی تعیین کے لیے اس رات کو فرشتے اترتے ہیں۔ اس قسم کی ایک خاص رات میں قرآن کا نزول شروع ہوا۔",
        "بظاہر ایسا معلوم ہوتا ہے کہ اس رات کو زمین پر فرشتوں کی کثرت ہوتی ہے۔ اس سے زمین پر خاص طرح کا روحانی ماحول پیدا ہوتا ہے۔ اب جو لوگ اپنے اندر روحانیت بیدار کیے ہوئے ہوں وہ اس سے متاثر ہوتے ہیں اور اس کے نتیجہ میں ان کے اندر غیر معمولی روحانی تاثیر پیدا ہوجاتی ہے جو ان کے دیني عمل کی قدروقیمت عام حالات سے بہت زیادہ بڑھا دیتی ہے۔"
      ]
    },
    "themes": [
      "time",
      "angels",
      "glad-tidings"
    ],
    "related": []
  }
]
