[
  {
    "id": "101:1",
    "surah": "101",
    "number": 1,
    "globalNumber": 6158,
    "bismillah": true,
    "arabic": "ٱلۡقَارِعَةُ",
    "urdu": "عظیم حادثہ",
    "english": "The Striking Calamity",
    "tafsir": {
      "source": "Bayan ul Quran",
      "paragraphs": [
        "آدمی چاہتا ہے کہ وہ زیادہ سے زیادہ کمائے، وہ زیادہ سے زیادہ سازوسامان اپنے پاس جمع کرے۔ وہ اسی دھن میں لگا رہتا ہے۔ یہاں تک کہ اس کی موت آجاتی ہے۔ اس وقت اس کو معلوم ہوتا ہے کہ جمع کرنے کی چیز تو دوسری تھی اور میں کسی اور چیز کو جمع کرنے میں مصروف رہا۔",
        "دنیا کی چیزوں کا اضافہ صرف آدمی کی مسئولیت کو بڑھاتا ہے۔ اور آدمی اپنی نادانی سے یہ سمجھتا ہے کہ وہ اپنی کامیابی میں اضافہ کر رہا ہے۔"
      ]
    },
    "themes": [
      "akhirah"
    ],
    "related": []
  },
  {
    "id": "101:2",
    "surah": "101",
    "number": 2,
    "globalNumber": 6159,
    "bismillah": false,
    "arabic": "مَا ٱلۡقَارِعَةُ",
    "urdu": "کیا ہے وہ عظیم حادثہ؟",
    "english": "What is the Striking Calamity",
    "tafsir": {
      "source": "Bayan ul Quran",
      "paragraphs": [
        "آدمی چاہتا ہے کہ وہ زیادہ سے زیادہ کمائے، وہ زیادہ سے زیادہ سازوسامان اپنے پاس جمع کرے۔ وہ اسی دھن میں لگا رہتا ہے۔ یہاں تک کہ اس کی موت آجاتی ہے۔ اس وقت اس کو معلوم ہوتا ہے کہ جمع کرنے کی چیز تو دوسری تھی اور میں کسی اور چیز کو جمع کرنے میں مصروف رہا۔",
        "دنیا کی چیزوں کا اضافہ صرف آدمی کی مسئولیت کو بڑھاتا ہے۔ اور آدمی اپنی نادانی سے یہ سمجھتا ہے کہ وہ اپنی کامیابی میں اضافہ کر رہا ہے۔"
      ]
    },
    "themes": [
      "akhirah"
    ],
    "related": []
  },
  {
    "id": "101:3",
    "surah": "101",
    "number": 3,
    "globalNumber": 6160,
    "bismillah": false,
    "arabic": "وَمَآ أَدۡرَىٰكَ مَا ٱلۡقَارِعَةُ",
    "urdu": "تم کیا جانو کہ وہ عظیم حادثہ کیا ہے؟",
    "english": "And what can make you know what is the Striking Calamity",
    "tafsir": {
      "source": "Bayan ul Quran",
      "paragraphs": [
        "آدمی چاہتا ہے کہ وہ زیادہ سے زیادہ کمائے، وہ زیادہ سے زیادہ سازوسامان اپنے پاس جمع کرے۔ وہ اسی دھن میں لگا رہتا ہے۔ یہاں تک کہ اس کی موت آجاتی ہے۔ اس وقت اس کو معلوم ہوتا ہے کہ جمع کرنے کی چیز تو دوسری تھی اور میں کسی اور چیز کو جمع کرنے میں مصروف رہا۔",
        "دنیا کی چیزوں کا اضافہ صرف آدمی کی مسئولیت کو بڑھاتا ہے۔ اور آدمی اپنی نادانی سے یہ سمجھتا ہے کہ وہ اپنی کامیابی میں اضافہ کر رہا ہے۔"
      ]
    },
    "themes": [
      "akhirah"
    ],
    "related": []
  },
  {
    "id": "101:4",
    "surah": "101",
    "number": 4,
    "globalNumber": 6161,
    "bismillah": false,
    "arabic": "يَوۡمَ يَكُونُ ٱلنَّاسُ كَٱلۡفَرَاشِ ٱلۡمَبۡثُوثِ",
    "urdu": "وہ دن جب لوگ بکھرے ہوئے پروانوں کی طرح",
    "english": "It is the Day when people will be like moths, dispersed",
    "tafsir": {
      "source": "Bayan ul Quran",
      "paragraphs": [
        "آدمی چاہتا ہے کہ وہ زیادہ سے زیادہ کمائے، وہ زیادہ سے زیادہ سازوسامان اپنے پاس جمع کرے۔ وہ اسی دھن میں لگا رہتا ہے۔ یہاں تک کہ اس کی موت آجاتی ہے۔ اس وقت اس کو معلوم ہوتا ہے کہ جمع کرنے کی چیز تو دوسری تھی اور میں کسی اور چیز کو جمع کرنے میں مصروف رہا۔",
        "دنیا کی چیزوں کا اضافہ صرف آدمی کی مسئولیت کو بڑھاتا ہے۔ اور آدمی اپنی نادانی سے یہ سمجھتا ہے کہ وہ اپنی کامیابی میں اضافہ کر رہا ہے۔"
      ]
    },
    "themes": [
      "akhirah",
      "resurrection"
    ],
    "related": []
  },
  {
    "id": "101:5",
    "surah": "101",
    "number": 5,
    "globalNumber": 6162,
    "bismillah": false,
    "arabic": "وَتَكُونُ ٱلۡجِبَالُ كَٱلۡعِهۡنِ ٱلۡمَنفُوشِ",
    "urdu": "اور پہاڑ رنگ برنگ کے دھنکے ہوئے اون کی طرح ہوں گے",
    "english": "And the mountains will be like wool, fluffed up",
    "tafsir": {
      "source": "Bayan ul Quran",
      "paragraphs": [
        "آدمی چاہتا ہے کہ وہ زیادہ سے زیادہ کمائے، وہ زیادہ سے زیادہ سازوسامان اپنے پاس جمع کرے۔ وہ اسی دھن میں لگا رہتا ہے۔ یہاں تک کہ اس کی موت آجاتی ہے۔ اس وقت اس کو معلوم ہوتا ہے کہ جمع کرنے کی چیز تو دوسری تھی اور میں کسی اور چیز کو جمع کرنے میں مصروف رہا۔",
        "دنیا کی چیزوں کا اضافہ صرف آدمی کی مسئولیت کو بڑھاتا ہے۔ اور آدمی اپنی نادانی سے یہ سمجھتا ہے کہ وہ اپنی کامیابی میں اضافہ کر رہا ہے۔"
      ]
    },
    "themes": [
      "akhirah",
      "nature-signs"
    ],
    "related": []
  },
  {
    "id": "101:6",
    "surah": "101",
    "number": 6,
    "globalNumber": 6163,
    "bismillah": false,
    "arabic": "فَأَمَّا مَن ثَقُلَتۡ مَوَٰزِينُهُۥ",
    "urdu": "پھر جس کے پلڑے بھاری ہوں گے",
    "english": "Then as for one whose scales are heavy [with good deeds]",
    "tafsir": {
      "source": "Bayan ul Quran",
      "paragraphs": [
        "آدمی چاہتا ہے کہ وہ زیادہ سے زیادہ کمائے، وہ زیادہ سے زیادہ سازوسامان اپنے پاس جمع کرے۔ وہ اسی دھن میں لگا رہتا ہے۔ یہاں تک کہ اس کی موت آجاتی ہے۔ اس وقت اس کو معلوم ہوتا ہے کہ جمع کرنے کی چیز تو دوسری تھی اور میں کسی اور چیز کو جمع کرنے میں مصروف رہا۔",
        "دنیا کی چیزوں کا اضافہ صرف آدمی کی مسئولیت کو بڑھاتا ہے۔ اور آدمی اپنی نادانی سے یہ سمجھتا ہے کہ وہ اپنی کامیابی میں اضافہ کر رہا ہے۔"
      ]
    },
    "themes": [
      "akhirah",
      "adl"
    ],
    "related": []
  },
  {
    "id": "101:7",
    "surah": "101",
    "number": 7,
    "globalNumber": 6164,
    "bismillah": false,
    "arabic": "فَهُوَ فِي عِيشَةٖ رَّاضِيَةٖ",
    "urdu": "وہ دل پسند عیش میں ہوگا",
    "english": "He will be in a pleasant life",
    "tafsir": {
      "source": "Bayan ul Quran",
      "paragraphs": [
        "آدمی چاہتا ہے کہ وہ زیادہ سے زیادہ کمائے، وہ زیادہ سے زیادہ سازوسامان اپنے پاس جمع کرے۔ وہ اسی دھن میں لگا رہتا ہے۔ یہاں تک کہ اس کی موت آجاتی ہے۔ اس وقت اس کو معلوم ہوتا ہے کہ جمع کرنے کی چیز تو دوسری تھی اور میں کسی اور چیز کو جمع کرنے میں مصروف رہا۔",
        "دنیا کی چیزوں کا اضافہ صرف آدمی کی مسئولیت کو بڑھاتا ہے۔ اور آدمی اپنی نادانی سے یہ سمجھتا ہے کہ وہ اپنی کامیابی میں اضافہ کر رہا ہے۔"
      ]
    },
    "themes": [
      "jannah",
      "glad-tidings"
    ],
    "related": []
  },
  {
    "id": "101:8",
    "surah": "101",
    "number": 8,
    "globalNumber": 6165,
    "bismillah": false,
    "arabic": "وَأَمَّا مَنۡ خَفَّتۡ مَوَٰزِينُهُۥ",
    "urdu": "اور جس کے پلڑے ہلکے ہوں گے",
    "english": "But as for one whose scales are light",
    "tafsir": {
      "source": "Bayan ul Quran",
      "paragraphs": [
        "آدمی چاہتا ہے کہ وہ زیادہ سے زیادہ کمائے، وہ زیادہ سے زیادہ سازوسامان اپنے پاس جمع کرے۔ وہ اسی دھن میں لگا رہتا ہے۔ یہاں تک کہ اس کی موت آجاتی ہے۔ اس وقت اس کو معلوم ہوتا ہے کہ جمع کرنے کی چیز تو دوسری تھی اور میں کسی اور چیز کو جمع کرنے میں مصروف رہا۔",
        "دنیا کی چیزوں کا اضافہ صرف آدمی کی مسئولیت کو بڑھاتا ہے۔ اور آدمی اپنی نادانی سے یہ سمجھتا ہے کہ وہ اپنی کامیابی میں اضافہ کر رہا ہے۔"
      ]
    },
    "themes": [
      "akhirah",
      "adl"
    ],
    "related": []
  },
  {
    "id": "101:9",
    "surah": "101",
    "number": 9,
    "globalNumber": 6166,
    "bismillah": false,
    "arabic": "فَأُمُّهُۥ هَاوِيَةٞ",
    "urdu": "اس کی جائے قرار گہری کھائی ہوگی",
    "english": "His refuge will be an abyss",
    "tafsir": {
      "source": "Bayan ul Quran",
      "paragraphs": [
        "آدمی چاہتا ہے کہ وہ زیادہ سے زیادہ کمائے، وہ زیادہ سے زیادہ سازوسامان اپنے پاس جمع کرے۔ وہ اسی دھن میں لگا رہتا ہے۔ یہاں تک کہ اس کی موت آجاتی ہے۔ اس وقت اس کو معلوم ہوتا ہے کہ جمع کرنے کی چیز تو دوسری تھی اور میں کسی اور چیز کو جمع کرنے میں مصروف رہا۔",
        "دنیا کی چیزوں کا اضافہ صرف آدمی کی مسئولیت کو بڑھاتا ہے۔ اور آدمی اپنی نادانی سے یہ سمجھتا ہے کہ وہ اپنی کامیابی میں اضافہ کر رہا ہے۔"
      ]
    },
    "themes": [
      "jahannam"
    ],
    "related": []
  },
  {
    "id": "101:10",
    "surah": "101",
    "number": 10,
    "globalNumber": 6167,
    "bismillah": false,
    "arabic": "وَمَآ أَدۡرَىٰكَ مَا هِيَهۡ",
    "urdu": "اور تمہیں کیا خبر کہ وہ کیا چیز ہے؟",
    "english": "And what can make you know what that is",
    "tafsir": {
      "source": "Bayan ul Quran",
      "paragraphs": [
        "آدمی چاہتا ہے کہ وہ زیادہ سے زیادہ کمائے، وہ زیادہ سے زیادہ سازوسامان اپنے پاس جمع کرے۔ وہ اسی دھن میں لگا رہتا ہے۔ یہاں تک کہ اس کی موت آجاتی ہے۔ اس وقت اس کو معلوم ہوتا ہے کہ جمع کرنے کی چیز تو دوسری تھی اور میں کسی اور چیز کو جمع کرنے میں مصروف رہا۔",
        "دنیا کی چیزوں کا اضافہ صرف آدمی کی مسئولیت کو بڑھاتا ہے۔ اور آدمی اپنی نادانی سے یہ سمجھتا ہے کہ وہ اپنی کامیابی میں اضافہ کر رہا ہے۔"
      ]
    },
    "themes": [
      "jahannam"
    ],
    "related": []
  },
  {
    "id": "101:11",
    "surah": "101",
    "number": 11,
    "globalNumber": 6168,
    "bismillah": false,
    "arabic": "نَارٌ حَامِيَةُۢ",
    "urdu": "بھڑکتی ہوئی آگ",
    "english": "It is a Fire, intensely hot",
    "tafsir": {
      "source": "Bayan ul Quran",
      "paragraphs": [
        "آدمی چاہتا ہے کہ وہ زیادہ سے زیادہ کمائے، وہ زیادہ سے زیادہ سازوسامان اپنے پاس جمع کرے۔ وہ اسی دھن میں لگا رہتا ہے۔ یہاں تک کہ اس کی موت آجاتی ہے۔ اس وقت اس کو معلوم ہوتا ہے کہ جمع کرنے کی چیز تو دوسری تھی اور میں کسی اور چیز کو جمع کرنے میں مصروف رہا۔",
        "دنیا کی چیزوں کا اضافہ صرف آدمی کی مسئولیت کو بڑھاتا ہے۔ اور آدمی اپنی نادانی سے یہ سمجھتا ہے کہ وہ اپنی کامیابی میں اضافہ کر رہا ہے۔"
      ]
    },
    "themes": [
      "jahannam"
    ],
    "related": []
  }
]
